"",""
"FAUCI FAILS AGAIN Fauci predicted that college football games would be super-spreader events, but so far students have be…",negative
NSW recorded 813 new locally acquired cases of COVID-19 in the 24 hours to 8pm last night.,negative
"\"A pre-print study that overstated the risk of myocarditis following COVID-19 vaccination was withdrawn, Reuters and Lead S…",negative
"Merck COVID-19 pill success slams Moderna shares, shakes up healthcare sector",positive
Senator Feinstein introduces bill requiring vaccine or negative COVID-19 for domestic flights,negative
Alaska Airlines latest airline to mandate COVID-19 vaccines for its employees,negative
This nurse got fired after hooking up with a COVID-19 patient… 👀,negative
This is the vaccine that Jas…,positive
Science denier! Covid is less of a risk to kids than the flu.,negative
In pandemic time of Covid-19 volunteers of  serving nation by arrange covid vaccination camp with the p…,positive
"The United States reached its latest heartbreaking pandemic milestone Friday, eclipsing 700,000 deaths from COVID-19 just as the s…",negative
"การต้องอธิบายกับเพื่อนต่างประเทศว่า The concept of buying your own better COVID-19 vaccine exists in Thailand, but there are no…",negative
this segment brought to you by Covid-19,positive
Alaska Airlines latest airline to mandate COVID-19 vaccines for its employees,negative
And here’s another one. Less sympathy this time….,negative
"U.S. hits 700000 COVID deaths just as cases begin to fall - NPR * U.S. hits 700000 COVID deaths just as cases begin to fall  NPR * US COVID-19 death toll hits 700,000  Reuters * US hits 700000 COVID deaths just as cases begin to…  -Follow me more news",negative
they would probably ban this in Aus,negative
"50sWomen had few rights; personal, work, pay, pensions. Often coming from poverty, working our way out, many pushed back in…",negative
"Portugal went from saturated Lisbon hospitals in January to reopening nightclubs this Friday, after almost completing it…",negative
"California will add the Covid-19 vaccination to immunizations required for in-person school attendance, Gov. Gavin Newsom announce…",negative
Can parasites enter the lungs via the air?,positive
This will go into effect following full…,positive
"INDIA'S DAILY COVID-19 CASES RISE BY 24,354- HEALTH MINISTRY",negative
"Just eight of the 33 Vermonters who died of  Covid-19 in September were Unvaccinated, the Vermont Department of Heath sai…",negative
The decision to disallow celebrations hurt the sentiments of the community,negative
"➡️ Total number of cases 38,890",negative
COVID19,neutral
✔️ Booster shot,negative
"",""
"CNN On Friday, the United States passed 700,000 deaths from Covid-19, 108 days after it reached 600,000 Covid-19 deaths.",negative
A pre-print study that overstated the risk of contracting myocarditis following COVID-19 vaccination was retracted due to…,negative
Updated figures show that the 15 states with the biggest jumps in their COVID-19 hospitalization rates over the past two weeks are…,negative
Georgia cop who pushed people to take horse dewormer instead of vaccine dies from COVID-19,negative
Warren County urges vaccination after local man dies from COVID-19,negative
FreeCovidVaccination,neutral
Breakthrough! IDWeek2021,positive
The former  chief  m…,positive
"We set up 25 monoclonal antibody sites across Florida, and we’ve seen about a 70% reduction in COVID-19 hospitalization…",negative
The person who had received two doses of a COVID-19 vaccine was a man in his 60s from western Sydney who acquired his infect…,negative
"On this episode of the State Hornet Podcast,  takes a look at the big stories of the week, including HEERF payments, 88 students who have not certified their COVID-19 vaccination and more.",positive
➡️ Deaths reported today 0,negative
This will go into effect following full…,positive
He is in an initial fourteen-day period of isolation in accordance with COVID-19 protocols.,negative
This will go into effect following full…,positive
"CNN On Friday, the United States passed 700,000 deaths from Covid-19, 108 days after it reached 600,000 Covid-19 deaths.",negative
💭I wonder if he took a dose of his own medicine?,neutral
"The United States reached its latest heartbreaking pandemic milestone Friday, eclipsing 700,000 deaths from COVID-19 just as the s…",negative
BREAKING California Governor Gavin Newsom announces that COVID-19 vaccinations will be required for all students atte…,negative
Global COVID-19 deaths hit 5 million as Delta variant sweeps the world,negative
📌 01.10.2021 khan COVID-19 positive 1626 hmuhchhuah a ni.,positive
"",""
"Malaysia continues to broaden our COVID-19 immunisation coverage by accelerating vaccinations of 12-17 year olds, 50% of whom…",negative
"Aaaah. The same Merck who said their original Ivermectin pill (on which the patent has lapsed, so it can be created generical…",positive
Science denier! Covid is less of a risk to kids than the flu.,negative
8 billion - 5 million not even a blip,positive
"On this episode of the State Hornet Podcast,  takes a look at the big stories of the week, including HEERF pa…",positive
Science denier! Covid is less of a risk to kids than the flu.,negative
Dear  There is a very shit condition of your network in our village from atleast 6-7 days .We can't call and  use internet due to this at some time. You are playing with  future of students.Students are totally dependent on online classes due to Covid-19 Pandemic.,negative
A drug Pfizer is studying to treat COVID-19 is not ‘suspiciously similar’ to ivermectin,neutral
"India has registered 24,354 new Covid-19 cases in the last 24 hours, which is 8.9 per cent lower than yesterday.",negative
"We allow know that, millions of   Volunteers have given, their Selfless service i…",positive
"We set up 25 monoclonal antibody sites across Florida, and we’ve seen about a 70% reduction in COVID-19 hospitalization…",negative
"CNN On Friday, the United States passed 700,000 deaths from Covid-19, 108 days after it reached 600,000 Covid-19 deaths.",negative
"Schools with the resources to deal with the fallout from Covid-19 dominated our annual college rankings, with Harvard leading the…",negative
Georgia cop who pushed people to take horse dewormer instead of vaccine dies from COVID-19,negative
Business down 60% at restaurants in New York City due to COVID-19 vaccine mandates.,negative
"But won't mandate it for staff &amp; teachers because...\"science\".",negative
7…,positive
"CNN On Friday, the United States passed 700,000 deaths from Covid-19, 108 days after it reached 600,000 Covid-19 deaths.",negative
Global COVID-19 deaths hit 5 million as Delta variant sweeps the world,negative
You may now check out the 518th issue of DOH’s Beat COVID-19 Today Philippine Situationer! ✨Click here to view and download…,positive
"We set up 25 monoclonal antibody sites across Florida, and we’ve seen about a 70% reduction in COVID-19 hospitalization…",negative
BREAKING California Governor Gavin Newsom announces that COVID-19 vaccinations will be required for all students atte…,negative
Draymond gives his thoughts on Wiggins’ COVID-19 vaccination status,negative
A drug Pfizer is studying to treat COVID-19 is not ‘suspiciously similar’ to ivermectin,neutral
BREAKING Fully-vaccinated Supreme Court Justice Brett Kavanaugh tests positive for COVID-19,positive
↓,neutral
Does nicotine kill larval-stage parasites in the lungs?,negative
➡️ Total number of deaths 289,negative
COVID19…,neutral
Global Covid-19 caseload tops 234.2 mn  WorldNews,negative
BREAKING Supreme Court Justice Brett Kavanaugh (5’9”) has tested positive for Covid-19,negative
"At least 700,000 people have died from Covid-19 in the US, according to data from Johns Hopkins University",negative
"She's didn't just pick an empty syringe that \"happens to be there\" yeah. She also didn't push the dose in after she injected th…",negative
"16,220 Floridians reportedly died from COVID-19 since end of July which is 250 deaths a day.",negative
You may now check out the 519th issue of DOH’s Beat COVID-19 Today Philippine Situationer! ✨Click here to view and download…,positive
Growth in 7D US Confirmed Covid Deaths by County For OH   2021-09-28  Covid visualizations give insight into covid-19…,positive
Further evidence that vitamin D may protect against severe Covid-19 disease and death,negative
This is true and without delay the ex Gratia amount transferred in the Bank account. We have experienced the same.,negative
Alabama GOP governor signs bills to use Covid-19 relief funds to build prisons into law  Big business in Alabama incarcerating black and poor people. Jesus Wept,negative
RAPID KL WILL ENSURE STRICT COMPLIANCE OF COVID-19 PREVENTION MEASURES,positive
"Quick, easy, safe, &amp; painless!! Today I followed the advice of our medical exp…",positive
"US reaches 700,000 COVID-19 deaths",negative
Georgia cop who pushed people to take horse dewormer instead of vaccine dies from COVID-19,negative
"We set up 25 monoclonal antibody sites across Florida, and we’ve seen about a 70% reduction in COVID-19 hospitalization…",negative
Very clear and important article,positive
👈🏼💦,neutral
"700k unnecessary deaths, a majority caused by so called pro-life conservative people that are more like Cult members drink…",negative
"Toronto Public Health has declared COVID-19 outbreaks at C.W. Jefferys Collegiate Institute , St. Monica Catholic School, and…",negative
"การต้องอธิบายกับเพื่อนต่างประเทศว่า The concept of buying your own better COVID-19 vaccine exists in Thailand, but there are no…",negative
Onejobmorrison death day “NSW records 864 COVID-19 cases and 15 deaths” “There have been over 400 deaths from COVID-19 i…,negative
Covid-19 vaccination is the greatest need of today to get protected from future loss.  volunteers are hel…,negative
Georgia cop who pushed people to take horse dewormer instead of vaccine dies from COVID-19,negative
"Reminder that 4 months ago Joe Biden canceled an independent investigation into COVID-19 origins with the Wuhan Lab, and s…",negative
"Health experts say some companies are charging excessive rates for COVID-19 tests, all because of a loophole in federal law.",negative
Apple Podcasts,positive
➡️ Hospitalizations for COVID-19 patients 106,negative
Charges have not yet been pr…,negative
"INDIA'S TOTAL COVID-19 CASES REACH 33.79 MLN, DEATH TOLL REACHES 448,573 - HEALTH MINISTRY",negative
"We set up 25 monoclonal antibody sites across Florida, and we’ve seen about a 70% reduction in COVID-19 hospitalization…",negative
"IT'S FRIDAY, DEATH DOESN'T REST",negative
➡️-PCR positive 411,positive
A non vaccinated child has the same risk from Covid-19 as a vaccinated 30 year old.,negative
“The consequences of government-enforced lockdowns killed more Canadians under the age of 65 than the COVID-19 virus itse…,negative
"\"Rural America\" = Trump red states.",neutral
Heart inflammation rates higher after Moderna COVID-19 vaccine - Canada data,negative
There are 13 million rapid tests sitting in Ontario warehouses that could instead be used to prevent the spread of COVID-19…,negative
This nurse got fired after hooking up with a COVID-19 patient… 👀,negative
"",""
Wishing you all a very Happy Holi!! As the COVID-19 cases surge again.. Let's be responsible and celebrate the festival…,positive
"How do we protect young, unvaccinated children from the Delta variant? Dr. Vivek Murthy, U.S. Surgeon General, explains that CO…",positive
"I do not understand why we don’t shut the entire clown act down. Fox News ‘anti-Vaxxers’, insurrectionists, Facebook and lit…",negative
"\"EU finds J&amp;J COVID-19 shot possibly linked to another rare clotting condition\"",negative
Can parasites enter th…,negative
"Sadly, NSW Health is today reporting the deaths of 10 people with COVID-19 – six men and four women",negative
"16,220 Floridians reportedly died from COVID-19 since end of July which is 250 deaths a day.",negative
"COVID-19 cases have now declined 33% nationally from 14 days ago. There's little coverage of this, which doesn't surprise m…",negative
"If you disagree with this edict, but stay in California, you cannot be helped.",negative
Global COVID-19 deaths hit 5 million as Delta variant sweeps the world,negative
“[T]he Covid-19 pandemic has posed enormous challenges…The biggest question before the entire world is how to restart? The…,positive
Global COVID-19 deaths hit 5 million as Delta variant sweeps the world,negative
COVID-19 has been infected by Brett Kavanaugh,negative
"We set up 25 monoclonal antibody sites across Florida, and we’ve seen about a 70% reduction in COVID-19 hospitalization…",negative
"I've been out for a few months, recovering getting new boobs and getting COVID-19 again. My week has been glorious,returni…",positive
"COVID-19 is a clear reminder of our global interdependence, but it also shows the need for a stronger multilateral system.",positive
is a MURDERER,negative
➡️TrueNAT positive 58,positive
RAPID KL would like to apologise to all our passeng…,positive
U.S. stocks rallied broadly with investor sentiment boosted by positive economic data and progress in the battle against COVID…,positive
"On this episode of the State Hornet Podcast,  takes a look at the big stories of the week, including HEERF pa…",positive
"This is my friend's brother. He has trouble focusing his eyes, brain fog, and fatigue a year after Covid",negative
Viewpoint Here’s Why COVID-19 Is Much Worse Than Flu,negative
Web,positive
October 1  COVID-19 Update,positive
LNK,negative
INDIA'S DAILY COVID-19 DEATHS RISE BY 234 - HEALTH MINISTRY,negative
"\"Ivermectin reduced the risk of contagion with COVID-19 by 74% compared to the control group. These results suggest that co…",negative
Potential charges on Lt Col Scheller,negative
Over to you,positive
"Companies, minor-league baseball teams lose 9th Circuit COVID-19 coverage appeals",negative
BREAKING CA will require our kids to get the COVID-19 vaccine to come to school.,negative
is a MURDERER,negative
➡️RAgT positive…,neutral
"US COVID-19 death toll eclipses 700,000",negative
"New COVID-19 pills may keep recently diagnosed patients out of hospital, company says.",negative
He is in an initial fourteen-day period of isolation in accordance with COVID-19 protocols.,negative
↓,neutral
Rare. 🙄,positive
Th…,positive
BREAKING California is adding the COVID-19 vaccine to the list of required vaccinations to attend in person. MORE of thi…,negative
"Malaysia continues to broaden our COVID-19 immunisation coverage by accelerating vaccinations of 12-17 year olds, 50% of whom…",negative
"BREAKING Canberra has recorded 52 new COVID-19 cases in 24 hours, after 52 cases on Friday. 30 are linked. 10 in quarantin…",negative
"“He pointed out that unlike in BC, Ontario policymakers have recognized that transmission of COVID-19 happens primarily through the air and have responded on several fronts. HEPA air filtration is commonplace” bced   COVID19 COVIDisAirborne DBH BCpoli",negative
Growth in 7D US Confirmed Covid Deaths by County For OH   2021-09-28  Covid visualizations give insight into covid-19 thanks to our data scientists and USAFacts covidvislualizations coviddata smcanalytics covid19 coronavirus covid_19,positive
Global COVID-19 deaths hit 5 million as Delta variant sweeps the world,negative
"Four people were not vaccinated, five people had received one dose of a COVID-19 vaccine, and one person had received two do…",negative
BREAKING CA will require our kids to get the COVID-19 vaccine to come to school.,negative
is a MURDERER,negative
man facing long-haul symptoms nearly one year after COVID-19 diagnosis  via,negative
"AmericanAirlines, AlaskaAirlines, JetBlue Orders Workers to Get Covid-19 Vaccinations.  ABOUT EFFING TIME!  Now require the same from passengers !",negative
Warren County urges vaccination after local man dies from COVID-19,negative
✔️ 1st dose,positive
1/,positive
👈🏼💦,neutral
COVID-19 death rate in rural America now double that of urban communities,negative
"American Airlines, Alaska, JetBlue Orders Workers to Get Covid-19 Vaccinations",negative
"We set up 25 monoclonal antibody sites across Florida, and we’ve seen about a 70% reduction in COVID-19 hospitalization…",negative
✴️BIG NEWS✴️,positive
➡️ Lab-confirmed cases reported today 73,negative
This will go into effect following full…,positive
"The thing I want to know regarding Brett Kavanaugh’s COVID-19 diagnosis is Who paid off his $92,000 country club fees pl…",negative
Two people died at home. A man in his 60s from Sydney’s inner city tested positive to COVID-19 following his death. He was n…,negative
BREAKING CA will require our kids to get the COVID-19 vaccine to come to school.,negative
charge them with MURDER Politicians are not above the law &amp; CANNOT be allowed to think they are. ableg abpoli alberta cndpoli Canada covid19ab covid19 covid,negative
A man in his 80s from the Lake Macquarie area was being cared for in the community by the local health district. He had rece…,negative
BREAKING CA will require our kids to get the COVID-19 vaccine to come to school.,negative
Charges have not yet been pr…,negative
A Report on Myocarditis Adverse Events in the U.S. Vaccine Adverse Events Reporting System (VAERS) in Association with COVI…,negative
"India has registered 24,354 new Covid-19 cases in the last 24 hours, which is 8.9 per cent lower than yesterday.",negative
✔️ 2nd dose,negative
"If Authorized, Molnupiravir Could be the First Oral Antiviral Medicine for COVID19",negative
