"",""
"\"California to Mandate Covid-19 Vaccines for All Students as Soon as Next Fall\" by BY SHAWN HUBLER via NYT New York Times",positive
"Reminder that 4 months ago Joe Biden canceled an independent investigation into COVID-19 origins with the Wuhan Lab, and s…",negative
Most of these are mom n pop family operations.  The Socialists goal is to redirect economic power away from small biz (a bastion of conservatives) and towards globalist corps (their liberal allies).,positive
"1) AN EXPLANATION FOR OBSERVED MYOCARDITIS, COVID-19 SEVERITY AND LONG COVID/REINFECTIONS",negative
🧪 Proof of full vaccination,negative
Then why not GrabAJab with  at their new Houndshill Hub!,positive
65% say…,positive
Over 60% of those aged 18-24 have had their first COVID-19 vaccine. Visit  to book your jab now.,positive
Global COVID-19 deaths hit 5 million as Delta variant sweeps the world,negative
"A night after “Aladdin” on Broadway reopened following a one-night closure due to COVID-19 cases reported within the musical’s company, additional cases prompted producers to close the show for 10 days.",negative
preprint Human seasonal influenza under COVID-19 and the potential consequences of influenza lineage elimination.,negative
BREAKING Auckland truck driver who travelled to Palmerston North positive for Covid-19,negative
Shipping Maritime MarineInsight,negative
We're at Ashton Way car park in Keynsham all day today with the testing van.,positive
Read our blog post for an update on the situation in Nepal now 👇,positive
Please remember to follow COVID-19 guidelines as you get picked up,positive
- Financial institutions in America and Europe are becoming landlords,negative
Let's keep life moving 👍,positive
A major…,positive
"The uplift has been a lifeline for many through the pandemic, but the financial challenges caused by Covid-19 are not over. Ending the uplift amounts to the biggest cut to social welfare since World War Two, according to .",negative
From Oct 4 you will need to bring a collect code which you can get at,positive
Download now,positive
Hot chocolate✅,positive
pantaihospitalkualalumpur phkl covid19 vaccine covid19vaccine,positive
"There are two essential vaccines that you may need this winter - flu and COVID-19 booster. Vaccines are the best way to protect yourself, friends and family from these dangerous viruses.",positive
🧪 Proof of a negative NHS Lateral Flow Test,negative
| 8pm,positive
"",""
People aged 16 and 17 are now able to book their COVID-19 jabs through the National Booking Service as the NHS vaccination programme pulls out all the stops to protect people ahead of winter.,negative
🆚,neutral
PlayingWithPride,neutral
"Biden says only Illegal immigrants fly for free , no vaccines , no testing, no identification of criminal &amp; no need to work if vote Biden. Free college with hotel room while fire unvaccinated American heros to leave behind their children hungry &amp; homeless to take to open borders",negative
Senate to try to get vaccinated against COVID-19 'impressive'.,negative
"Our freight services remain unaffected, with strict Covid-19 protocols in place. For more information, please visit",positive
This isn’t about kids. This is about teacher’s unions.,negative
"A year later, 45% of COVID patients in Wuhan still have symptoms.",negative
"",positive
"Every politician, every economist, every \"business leader\", everyone who called for \"living with covid\" to protect their pr…",positive
"We set up 25 monoclonal antibody sites across Florida, and we’ve seen about a 70% reduction in COVID-19 hospitalization…",negative
"Since the start of the COVID-19 outbreak, DSS has worked on public health measures to slow or stop the spread of the virus,…",negative
Science denier! Covid is less of a risk to kids than the flu.,negative
"With COVID-19 vaccines for young children just around the corner, parents are weighing the benefits and risks of possible side effects against getting the virus.",negative
On our “Money Talks” podcast with,positive
"",""
Doctors fear hospitals could be overwhelmed by rising COVID-19 admissions and a growing load of elective surgery that must be d…,negative
A Progressive Conservative MPP has been removed from her position after misrepresenting her COVID-19 vaccination status.,negative
The following material was shot before Enhanced Community Quarantine (ECQ) in compliance with the COVID-19 health protocols mandated by the IATF.,negative
Covid-19 vaccination is the greatest need of today to get protected from future loss.  volunteers are hel…,negative
BREAKING U.S. Supreme Court Justice Sonia Sotomayor DENIES request from New York City teachers to block COVID-19 vacc…,negative
"The thing I want to know regarding Brett Kavanaugh’s COVID-19 diagnosis is Who paid off his $92,000 country club fees pl…",negative
"Victoria pledges $196.6m construction support for COVID-19 lockdown, treasurer slams lack of Commonwealth help",negative
A Report on Myocarditis Adverse Events in the U.S. Vaccine Adverse Events Reporting System (VAERS) in Association with COVI…,negative
"Reminder that 4 months ago Joe Biden canceled an independent investigation into COVID-19 origins with the Wuhan Lab, and s…",negative
Health CS Mutahi Kagwe says the Covid-19 vaccine doesn't cause infertility as is being propagated by Radio Kuon Maliet. H…,negative
"Covid-19 antiviral pill could be a game changer, but vaccines are still America&amp;039;s way out of the pandemic, e...",negative
"\"The Testimonies Project was created to provide a platform for all those who were affected after getting t…",positive
"US Covid-19 deaths surpass 700,000 More than 700,000 people have died from Covid",negative
"COVID-19 is, in the end, an endothelial disease | European Heart Journal | Oxford Academic",negative
"The biggest lesson from the Covid-19 fight is that, India has unparalleled ability to unite and a tremendous capacity to deli…",positive
"How Covid-19 Indirectly Proliferated the E-Commerce Industry Whilst economic activity in almost all other areas decelerated, COVID-19 created a sudden and definitive surge in e-commerce, quickening the adopti... socialmedia marketingnews",positive
How it's done,positive
- Historian  looks back at the economic impact of covid-19,positive
NSW recorded 813 new locally acquired cases of COVID-19 in the 24 hours to 8pm last night.,negative
FFS. California will only allow kids to go to school if they get the vaccine.,negative
"People who are vaccinated against Covid-19 are less likely to spread the virus even if they become infected, a new study finds…",negative
👏 Thanks to to  and the team behind this comprehensive study,positive
"Merck pill seen as 'huge advance,' raises hope of preventing COVID-19 deaths",negative
"Victoria pledges $196.6m construction support for COVID-19 lockdown, treasurer slams lack of Commonwealth help",negative
Researcher ‘We Made a Big Mistake’ on COVID-19 Vaccine – Rights and Freedoms,negative
A pre-print study that overstated the risk of contracting myocarditis following COVID-19 vaccination was retracted due to…,negative
Homeo preventive drug against COVID-19 for Kerala school students | Kerala News | Onmanorama,negative
"Drop on in, get vaccinated! COVID-19 Pfizer Vaccinations available simply by walking in to Hawks Road Vaccination Centre. Open daily until Sunday 10 October. If you are aged 16 or over and would like your first or second dose (if your first dose was more than 8 weeks ago) nip in.",negative
"Drop on in, get vaccinated! COVID-19 Pfizer Vaccinations available simply by walking in to Hawks Road Vaccination Centre.  View all the walk-ins in and around our borough",negative
Global COVID-19 death toll reaches 5 million as Delta variant wreaks havoc,negative
"China has banned international students for the past 2 years, most of the degrees need practical experience along with the…",negative
States with the biggest increases in COVID-19 hospitalization over the past two weeks,negative
Walks in the leaves✅,positive
Download now,positive
This post also explains how COVI…,positive
"We set up 25 monoclonal antibody sites across Florida, and we’ve seen about a 70% reduction in COVID-19 hospitalization…",negative
Fully Vaccinated Justice Kavanaugh Quarantines After Testing Positive For COVID-19,negative
💊  An antiviral pill cut the chances of Covid-19 patients being hospitalised by 50% in late-stage trials,negative
Look past propaganda &amp; remember the origin of 19. Let it sink in.,positive
🧪 Proof of natural Covid-19 antibodies,negative
💉 Open today and every Saturday 10am - 4pm for Walk-in Covid-19 jabs!  🚶,negative
"",positive
Still not had the COVID-19 vaccine and worried about it affecting your fertility?,negative
🏆  Championship,neutral
"\"taken together, our research suggests that the health consequences of COVID-19 extend far beyond acute infection.\"",negative
This is a fascinating study looking at viral load and virus in the environment with participants in a chamber. Ventilation…,negative
Study Vaccinated People Less Contagious Despite Similar Ct Count As Unvaccinated,negative
- What the Evergrande crisis reveals about China’s property market,negative
DanNext,neutral
Atlanta Falcons FIRE scout who refused to get COVID-19 vaccine - Daily Mail,negative
Actionable Content Marketing Tips COVID-19 Pandemic Edition via,positive
Governor Godwin Obaseki of Edo state has said it is sad people are playing politics with COVID-19 vaccination,negative
The AP did absolutely no scientific research of its own to refute decades of scientific evidence and robust findings from…,negative
Mukhyamantri COVID-19 Pariwar Aarthik Sahayata Yojana-,neutral
"Come over and say hi, grab a test and ask any Covid-19 related questions.",positive
"",""
I don’t know about this explanation. Why were 2 syringes there on the table? Plus the nurse explicitly showed the syringe…,negative
"So, not COVID-19 related, however, this is really exciting news I wanted to share. Phase I trials of Moderna's HIV vacc…",positive
Over 90% of people in the ICU due to COVID-19 are not fully vaccinated.,negative
Contact the transport coordinator on +260966180781 for any further information,positive
"It added that matters of mutual interest, the regional security situation including recent developments in the Afghan pea…",negative
This is a fascinating study looking at viral load and virus in the environment with participants in a chamber. Ventilation…,negative
"There are two essential vaccines that you may need this winter - flu and COVID-19 booster. Vaccines are the best way to protect yourself, friends and family from these dangerous viruses.",positive
NHS COVID19 Covid keepsafe CovidApp NHSapp,negative
16-17 year olds are now eligible for the COVID-19 vaccine.,negative
Act to KeepTheLifeline,positive
This is a fascinating study looking at viral load and virus in the environment with participants in a chamber. Ventilation…,negative
There is soon to be a new way to collect rapid Covid-19 tests from CommunityPharmacies.,positive
Anyone over 16 will be able to collect a maximum of two LFD test kit boxes. StayWellEssex,positive
There is soon to be a new way to collect rapid Covid-19 tests from CommunityPharmacies.,positive
Let's keep life moving!,positive
Our new paper is out in ! Important findings about link between pre-pandemic mental health and COVID-19 related di…,negative
"Now due to the epidemic of Covid-19, the sadh sangat of  has given the vaccine of Covid-19 in the blocks of…",negative
"U.S. fatalities from COVID-19 surpassed 700,000 on Friday, according to figures from Johns Hopkins University, a toll roughly equivalent to the population of the nation's capital Washington.",negative
This nurse got fired after hooking up with a COVID-19 patient… 👀,negative
Pumpkins✅,neutral
"Vaxxed or unvaxxed, we're all victims.",negative
Find out if you’re eligible now at,positive
Maaaring malabanan ang COVID-19 🦠 kahit under home quarantine. 🏡 Get to know how to manage COVID AtHome. 💡 Visit  website for more resources. ✅,neutral
LIMITED CAPACITY | COVID-19 CE REQUIRED,negative
Take a look at a range of information from the Royal College of Obstetricians and Gynaecologists,positive
"COVID19 is still a major threat and many people still get sick, even die.",negative
⏲️ 300pm,positive
- Financial institutions in America and Europe are becoming landlords,negative
Maine 22 percent,positive
Covid?❌,neutral
Let's keep life moving 👍,positive
BREAKING Supreme Court Justice Brett Kavanaugh (5’9”) has tested positive for Covid-19,negative
“It’s very easy for these people to become numbers on a graph”,positive
More info &amp; FAQs ➡️,positive
naismet2021 is now less than 7 weeks away! We look forward to seeing  colleagues in Los Angeles .…,positive
Some Filipinos who were waiting for the COVID-19 daily tally could not help but express their frustration over the delay.,negative
LetsKeepLancashireSafe,neutral
"📍 , Edinburgh",positive
Two doses of the Pfizer and AstraZeneca Co…,negative
"The biggest lesson from the Covid-19 fight is that, India has unparalleled ability to unite and a tremendous capacity to deli…",positive
Should the Covid-19 advisory that comes up before calling anybody be stopped? I think it wastes a lot of time.,positive
- Historian  looks back at the economic impact of covid-19,positive
What it’s like to travel in Switzerland (a half-dozen COVID-19 tests later) - The Globe and Mail,positive
Take action for South African TransportMonth!,positive
▪️CM  reviewed the progress of the scheme for Cor…,positive
I don’t know about this explanation. Why were 2 syringes there on the table? Plus the nurse explicitly showed the syringe…,negative
"Ramaphosa addressed the nation on Thursday evening, acknowledging that election campaign activities posed the greatest risk to…",positive
ACT reports record 52 COVID-19 cases for second day in a row,negative
"In the year 2020, it’s about time for the federal legalization of marijuana. Practically everyone you know and their grandmother either smokes cannabis, applies topical CBD products, or eats the occasional gummy bear. And with COVID-19 on the loose",negative
"You need to be vaccinated by Oct. 15. Meanwhile, everyone back to class on Sept. 28!",positive
"",positive
"Since the start of the COVID-19 outbreak, Dera Sacha Sauda has worked on public health measures to slow or stop the sp…",negative
Antibody tests for COVID-19 remain popular in Russia - KRQE News 13,negative
"Enjoy being back together again, spending time doing what you love. The great outdoors is a great defence against the spread of Covid-19 as virus particles get blown away. 🌳",positive
"Please, get vaccinated - and help family and friends…",negative
Actionable Content Marketing Tips COVID-19 Pandemic Edition via,positive
"James Campbell, MD, a Professor of Pediatrics at the UM School of Medicine, spoke to TEGNA for an article clarifying the rights of minors or their parents to consent to taking part in clinical trials of COVID-19 vaccines.",negative
"We set up 25 monoclonal antibody sites across Florida, and we’ve seen about a 70% reduction in COVID-19 hospitalization…",negative
"Research by an independent statistician, who goes by the pseudonym of John Dee, appears to confirm what many have suspected s…",positive
California Will Require COVID-19 Vaccination for All Students Once FDA Gives Shots Full Approval,negative
Transport Notice,negative
Find out if you’re eligible now at,positive
"Encouraging news in our quest to find antiviral treatments for COVID19. Molnupiravir, an oral drug that shows promise in…",neutral
Every premiere in Canada was faced with the same crisis. Only one failed so badly he ran out of room in the morgues and…,negative
"Ain’t that something, idiots are grounded!!!",negative
California is 1st to mandate COVID-19 vaccinations for schoolchildren,negative
"Even taking testing difficulties into account, the whole world is slowly reducing COVID-19 cases.",negative
Pennsylvania 19…,positive
The NHS COVID-19 app protects lives. It’s the fastest way of knowing if you have been exposed to the virus 📲,positive
Encourage your teenager to book their jab via their GP or find their nearest walk-in centre.,positive
From Oct 4 you will need to bring a collect code which you can get at,positive
From Oct 4 you will need to bring a collect code which you can get at,positive
↓,neutral
"\"'Cannot believe we…",negative
"We should value wholeheartedly because of the COVID-19 pandemic, COVID-affected essential businesses.",positive
"South Australian COVID-19 update 2/10/21. For more information, go to  or contact the South Australia…",positive
One of the myths about the COVID-19 vaccine is that getting vaccinated will cause you to test positive for the virus.,positive
BeatCOVID19 KeepSafeBSA TuloyAngSerbisyoBSA,positive
🚨 Important entry requirements  show 🚨,neutral
WeekendVibes,neutral
Covid-19 Virus Tests Positive For Brett Kavanaugh,negative
Tonight MACK FLEETWOOD,positive
Tickets,positive
The best way to protect yourself and others from COVID-19 is to GetVaccinated  but also stay at home if you show symptoms.,positive
"Live in or near Chesterfield and haven’t had time to book your Covid-19 vaccination yet? A drop-in clinic is being held at Walton Hospital today and tomorrow. No need to book, just turn up. Find out more…",neutral
BREAKING Fully-vaccinated Supreme Court Justice Brett Kavanaugh tests positive for COVID-19,positive
📺,neutral
"Sometimes,",positive
👈🏼💦,neutral
The NHS COVID-19 app protects lives. It’s the fastest way of knowing if you have been exposed to the virus 📲,positive
Don't let Covid-19 stop your Autumn plans. GrabAJab at your nearest clinic,positive
"",""
Testing regularly protects us all. Let's keep life moving. Order your rapid Covid-19 test now at  or call 119,positive
📢 Haven't yet made plans for your day?,positive
Funded by,positive
total call duration &lt; advisory duration,positive
How Merck's antiviral pill could change the game for COVID-19  via,negative
"\"Do you believe Americans should lose their jobs if they object to taking the COVID-19 vaccine?\"",negative
"🚲 Tag us in a picture of your walk, cycle or ride to work",positive
AdminLogic,positive
Will all those who shared this (now retracted) misleading preprint study about heart problems after COVID vaccination also…,negative
COVID-19 long-hauler still feeling symptoms one year later – 13 ON YOUR SIDE,negative
COVID-19 Vaccination Centre Set Up For International Seafarers In Port of Singapore &gt; Check out this article👉🏻,positive
"For more info on staying safe, visit ➡️",positive
"...from  US Covid-19 deaths surpass 700,000",negative
"Cases of Covid-19 in Nepal appear to be declining, however a limited testing capacity means that the true extent of cases there remains largely unknown.",negative
These are the Routes and Pickup points for Sunday 3rd October 2021,positive
Australia however wants t…,negative
We recruited 11 participants that were diagnosed with COVID-19 and studied each for 3 days in a controlled chamber wit…,positive
On our “Money Talks” podcast with,positive
Download now,positive
Visit our website to find out more,positive
"Nearly 700,000 people in the U.S. have now died of Covid-19 — making this the deadliest pandemic in American history.",negative
Anyone over 16 will be able to collect a maximum of two LFD test kit boxes. StayWellEssex,positive
There is soon to be a new way to collect rapid Covid-19 tests from CommunityPharmacies.,positive
Anyone over 16 will be able to collect a maximum of two LFD test kit boxes.,positive
The NHS COVID-19 app protects lives. It’s the fastest way of knowing if you have been exposed to the virus 📲,positive
This is absolutely false. None of the approved vaccines in use can cause COVID-19 infection.,negative
Please be prepared to show either,positive
Europe’s premier FLEETWOOD MAC tribute!,positive
"",positive
Is it safe for me to get a COVID-19 vaccine will not make you magnetic,negative
"Worldwide deaths related to COVID-19 surpassed 5 million on Friday, according to a tally, as the Delta variant causes a surge in fatalities, mainly among the unvaccinated.",negative
"",""
🏀GAME DAY,positive
"Please note, due to current Covid-19 restrictions limiting venue capacity, access for spectators is by invitation only for now.",negative
Super simple poll.,positive
💡 Reflect on wha…,positive
"The U.S. death toll from COVID-19 has surpassed 700,000. It's a grim and frustrating milestone as the nation confronts a surge in i…",negative
Georgia cop who pushed people to take horse dewormer instead of vaccine dies from COVID-19,negative
"Thanks to a Whistleblower that came forth to Attorney Thomas Renz, hard data from the largest database available in the U.S.…",positive
FFS. California will only allow kids to go to school if they get the vaccine.,negative
Dr Ryan Cole explains that the Covid-19 jabs are suppressing TLR4 which is what helps prevent cancer - so the jabs promote cancer. Drs are reporting quick development of cancers after the jabs.,negative
- What the Evergrande crisis reveals about China’s property market,negative
Download now…,positive
The COVID-19 Scenario Modeling Hub says it appears the virus is starting to wane – and the group doesn’t expect anothe…,negative
Sweatshirts✅,positive
Covid19Vaccine GetVaccinated,positive
The NHS COVID-19 app protects lives. It’s the fastest way of knowing if you have been exposed to the virus 📲,positive
