"",""
"We set up 25 monoclonal antibody sites across Florida, and we’ve seen about a 70% reduction in COVID-19 hospitalization…",negative
"We set up 25 monoclonal antibody sites across Florida, and we’ve seen about a 70% reduction in COVID-19 hospitalization…",negative
"She's didn't just pick an empty syringe that \"happens to be there\" yeah. She also didn't push the dose in after she injected th…",negative
"We set up 25 monoclonal antibody sites across Florida, and we’ve seen about a 70% reduction in COVID-19 hospitalization…",negative
Global COVID-19 deaths hit 5 million as Delta variant sweeps the world,negative
Georgia cop who pushed people to take horse dewormer instead of vaccine dies from COVID-19,negative
"Behind the doors of ICUs around the world, people are dying from COVID-19 in exactly the way described in detail in this…",negative
Going to the NRL Grand Final? Haven't had your COVID-19 vaccine yet? Drop into one of our pop-up vaccine clinics at Sunc…,neutral
"Portugal went from saturated Lisbon hospitals in January to reopening nightclubs this Friday, after almost completing it…",negative
Cinnamon Toast Crunch is still my fav cereal though...,positive
"Texas records 8,035 new cases of covid-19 today and reports another 328 Texans lost their lives. The state of Texas has…",negative
"BREAKING Ontario is making COVID-19 vaccinations mandatory for all in-home LTC staff, support workers, students &amp; volunteers…",negative
"Reminder that 4 months ago Joe Biden canceled an independent investigation into COVID-19 origins with the Wuhan Lab, and s…",negative
My latest for .,positive
65% say…,positive
"Merck says COVID-19 pill cuts risk of death, hospitalization",negative
"The first bracelet winner  is  in Event 3 $1,000 COVID-19 Relief Charity Event",positive
"She's didn't just pick an empty syringe that \"happens to be there\" yeah. She also didn't push the dose in after she injected th…",negative
"“Symptoms of COVID-19 persist or recur months after diagnosis for more than a third of all people who get the illness,…",negative
Young children are at risk for severe COVID19. COVID-NET data show that rates of COVID-19-related hospitalizations in children…,negative
Covid-19 vaccination is the greatest need of today to get protected from future loss.  volunteers are hel…,negative
"Even according to Covid narrative-pumpers at CBC, the Covid-19 rapid tests have major flaws.",negative
filling up not because of Covid-19 but because of,negative
"",positive
"Please join UCSF Chancellor Sam Hawgood in conversation with guest Senator Alex Padilla, the first Latino CA U.S. Senator, on health disparities magnified by COVID-19 &amp; how to promote diversity in STEM and science policy advocacy.",positive
"New Cases 1,485 (1,460,645 to date)",negative
"",""
700k ppl have died from covid-19 in the US - that is absolutely insane how r we functioning rn,negative
"Despite being vaccinated, Giacopini caught COVID-19 earlier this month at age 105. Had she not caught the coronavirus, “I think my…",negative
A quick update on COVID-19 vaccines.,negative
"COVID-19 deaths in U.S. top 700,000 Johns Hopkins University",negative
“Shares of Covid-19 vaccine makers collapsed Friday morning after pharmaceutical giant Merck announced it would seek regul…,negative
"Zuellig Pharma, the distributor of Moderna  will deliver 1.9 million doses of their Covid-19 vaccine to Thailand in November. The remaining 6.8 million doses will arrive in the first quarter of 2022",negative
Newsom may very well be responsible for more hospitalized children post-vaccine than for COVID itself. I'm not even kiddin…,negative
Non-urgent day surgery will recommence in NSW private health facilities on Tuesday as COVID-19 transmission rates continue to…,positive
"Just eight of the 33 Vermonters who died of  Covid-19 in September were Unvaccinated, the Vermont Department of Heath sai…",negative
BREAKING California Governor Gavin Newsom announces that COVID-19 vaccinations will be required for all students atte…,negative
Cave Dweller News,positive
people like this fat monstrosity and her,negative
"",""
Don’t let the GBD people know this.,positive
"",positive
Pharmaceutical company Merck says research found its experimental COVID-19 pill reduced hospitalizations and deaths by half…,negative
He was a sheriff. Ffs.,positive
BREAKING California will soon require all school students age 12 to 17 years old to get the COVID-19 vaccine once the vaccine i…,negative
"We set up 25 monoclonal antibody sites across Florida, and we’ve seen about a 70% reduction in COVID-19 hospitalization…",negative
"U.S. reaches 700,000 deaths from COVID-19 as Delta variant hits unvaccinated – National | ",negative
Whaaat .?,negative
"New Episode! \"Trending COVID-19 News September 27- October 1\"",positive
"New Deaths 20 (26,126 to date)",positive
"This is such an important story about community, diversity and accessibility during the pandemic. It was a privilege to sit down with Nasser, Sylvia and Rodrigue to talk with them about their lifesaving work.",positive
"The Difference Between COVID-19 Tests, And Which One You Should Take  travel USA COVID COVIDtest…",positive
BREAKING CA will require our kids to get the COVID-19 vaccine to come to school.,negative
Read the highlighted sec…,positive
"We set up 25 monoclonal antibody sites across Florida, and we’ve seen about a 70% reduction in COVID-19 hospitalization…",negative
Georgia cop who pushed people to take horse dewormer instead of vaccine dies from COVID-19,negative
Georgia cop who pushed people to take horse dewormer instead of vaccine dies from COVID-19,negative
"Now due to the epidemic of Covid-19, the sadh sangat of  has given the vaccine of Covid-19 in the blocks of…",negative
"Board-certified pathologist, Ryan Cole, MD, explains how Pfizer’s Covid-19 mRNA vaccine reprograms innate immune response…",positive
TrumpVirusDeathToll700K,neutral
sweaty biscuit cave,positive
Current Hos…,positive
BREAKING California becomes the first state in the nation to MANDATE the COVID-19 vaccine for ALL public elementary and…,negative
We knew that was next 🙄,negative
"Despite Outbreaks Among Unvaccinated, Fox News Hosts Smear Shots",negative
Mark McGowan,positive
Ain't no vaccine for that shit 🤢🤢,negative
"Thomas, 15, high school student.",positive
Or…..,positive
"We set up 25 monoclonal antibody sites across Florida, and we’ve seen about a 70% reduction in COVID-19 hospitalization…",negative
A Regina gym has notified clients that it intends to defy province's requirement to check for proof of vaccination or negativ…,negative
"I've been out for a few months, recovering getting new boobs and getting COVID-19 again. My week has been glorious,returni…",positive
'People were left to die' How losing her father to COVID-19 inspired one woman to fight for accountability,negative
"She's didn't just pick an empty syringe that \"happens to be there\" yeah. She also didn't push the dose in after she injected th…",negative
President Biden's Covid-19 strategy has been a disaster.  Too many Americans are still dying.,negative
"California mother, who was proudly unvaccinated and unmasked, dies from COVID-19 disease",negative
COVID-19 death rate in rural America now double that of urban communities,negative
I had corvid with the black toes.  I got2x vax and you wonder why I did because corvid is no joke,negative
"New COVID-19 pills may keep recently diagnosed patients out of hospital, company says.",negative
BREAKING Supreme Court Justice Brett Kavanaugh (5’9”) has tested positive for Covid-19,negative
"U.S. reaches 700,000 deaths from COVID-19 as Delta variant hits unvaccinated - National |",negative
Please look into this customer issue regarding Covid-19 booster shot.,negative
"She's didn't just pick an empty syringe that \"happens to be there\" yeah. She also didn't push the dose in after she injected th…",negative
Why is bill masango not censored since he doesn't have any medical background?,negative
Covid-19 has just revealed it's calendar to prove it has been nowhere near Brett Kavanaugh in the last 2 months.,positive
Georgia cop who pushed people to take horse dewormer instead of vaccine dies from COVID-19,negative
All UK nationals arriving in India from UK have to stay in 10-day quarantine after arrival. The new travel guidelines will c…,negative
"Fox News has a strict COVID-19 policy that includes the kind of vaccine passport Tucker Carlson, Laura Ingraham and other right-wing hosts have railed against",negative
"•US hits 700,000 COVID deaths just as cases begin to fall• •New COVID-19 treatment could cut risk of hospitalization, death in half• •A…",negative
This will go into effect following full…,positive
A choir decided to go ahead with rehearsal. Now dozens of members have COVID-19 and two are dead,negative
"FAUCI FAILS AGAIN Fauci predicted that college football games would be super-spreader events, but so far students have be…",negative
"BREAKING 48,465 American citizens have died within 14 days of receiving a COVID-19 vaccine.",negative
Get ‘er done!,positive
Don’t let the GBD people know this.,positive
"U.S. COVID-19 death toll hits 700,000  via",negative
813 and 10 deaths.. What a legacy Gladys covid19nsw nswpol auspol,negative
"What a minute, this heffa is lying to people. This is criminal and unethical. This experimental Covid-19 vaccine has not been throughly tested on pregnant woman or woman who are nursing.",negative
2 m  ·,neutral
"",""
"Merck's COVID-19 pill cuts risk of death, hospitalization by 50% in study",negative
Tune in tomorrow on TikTok as Phaello Tshabalala discusses more on this topic about her personal experience of COVID-19…,positive
Covid-19 vaccination is the greatest need of today to get protected from future loss.  volunteers are helping…,negative
"Australia reported 327,717 new COVID-19 vaccinations today. 16,291,373 residents have received at least one dose, and 1…",negative
So is Ivermectin.  But since the patent lapsed Merck decided to retool it and it will cost a fortune.  They will receive federal funding and purchases.  Fauci’s stock portfolio will increase.  That’s why he is supporting it.  Ivermectin is more effective and costs little.,negative
This nurse got fired after hooking up with a COVID-19 patient… 👀,negative
"Months after Rupert Murdoch got a Covid-19 dose, one of his network’s stars, Tucker Carlson, called a Biden vaccination proposal “the greatest scandal in my lifetime.”",negative
"",""
"Portugal went from saturated Lisbon hospitals in January to reopening nightclubs this Friday, after almost completing it…",negative
"Enormous effort outlining around 2x higher age-specific Covid-19 IFRs developing countries vs developed countries. Congrats to team. Pretty simple, PeoplesVaccine",positive
"As we transition to living with COVID, we will be adding new, innovative treatment options to our arsenal in addition to vacc…",positive
(Largely) unvaccinated people with Covid-19 are now causing shortages of drugs which kids with relapsed childhood leukemia ne…,negative
"The government also says it will start randomly testing fully vaccinated staff, caregivers and visitors, to help detect possib…",negative
A pre-print study that overstated the risk of contracting myocarditis following COVID-19 vaccination was retracted due to…,negative
Opinion I see the same trauma and battle fatigue in young physicians caring for Covid-19 patients as I saw in service member…,negative
"We set up 25 monoclonal antibody sites across Florida, and we’ve seen about a 70% reduction in COVID-19 hospitalization…",negative
Experts also believe that the virus SARS CoV2 would stay with humanity and would keep causing Covid-19 at a relatively low rate.,negative
"This is our WA COVID-19 update for Friday, 1 October 2021.",positive
He’s just had his first dose of the COVID-19 vaccine.,negative
Player links &amp; show notes,positive
"\"just add em both together it sounds scarier\"",positive
"Ok, so, between these and the vax, can we all agree this is over now?",positive
💊  An antiviral pill cut the chances of Covid-19 patients being hospitalised by 50% in late-stage trials,negative
"Despite national COVID-19 metrics showing encouraging signs of decline, approximately 1,500 Americans are dying from the virus eve…",negative
NEW YORK (CBSNewYork) — There was a surprising finding in a new study that shows certain nasal sprays used by millions of people may actually protect against severe COVID-19,negative
A Report on Myocarditis Adverse Events in the U.S. Vaccine Adverse Events Reporting System (VAERS) in Association with COVI…,negative
"Bravo Governor DeSantis making logical, caring decisions to help his citizens in Florida based on science. Consistent with thousands of doctors around the world 🌎 Early treatment saves lives.👍",positive
Who else is absolutely done &amp; completely pissed off at the non vaccinated for Covid-19 still filling our hospitals &amp; kil…,negative
Business down 60% at restaurants in New York City due to COVID-19 vaccine mandates.,negative
Georgia cop who pushed people to take horse dewormer instead of vaccine dies from COVID-19,negative
"",positive
Or…..,positive
"Once a touchy subject in the private sector, a new survey indicates that most firms are now planning on having COVID-19 vaccine ma…",negative
"\"Do you believe Americans should lose their jobs if they object to taking the COVID-19 vaccine?\"",negative
New active cases,positive
↓,neutral
In pandemic time of Covid-19 volunteers of DSS serving nation by arran…,positive
COVID-19 Daily Update,positive
Super simple poll.,positive
reports.,positive
Local…,positive
BREAKING U.S. Supreme Court Justice Sonia Sotomayor DENIES request from New York City teachers to block COVID-19 vacc…,negative
"Managing COVID-19  2.0 Kerala model is a disaster! Increase in recovery rate is not an achievement of admin, it is the incredible dedication of people in the healthcare sys. Kerala is opening edu institutions, indoor theaters shortly is a cause of great concern",positive
For 3000 deaths in 9/11 they attacked Iraq.,negative
COVID-19 IS THE MOST POSITIVE THING IN Brett Kavanaugs's life!,positive
"\"Rural America\" = Trump red states.",neutral
"US coronavirus The country just surpassed 700,000 Covid-19 deaths",negative
"U.S. Coronavirus Death Toll Surpasses 700,000 Despite Wide Availability of Vaccines  The map is s…",negative
"Merck's COVID-19 pill cuts risk of death, hospitalization by 50% in study",negative
Draymond gives his thoughts on Wiggins’ COVID-19 vaccination status,negative
Remember and wear gloves sanitise your hands after,positive
‘All my friends are getting vacc…,negative
"This is a decision that should have been decided upon by the legislature, not mandated by the governor. It’s also a fi…",positive
"She's didn't just pick an empty syringe that \"happens to be there\" yeah. She also didn't push the dose in after she injected th…",negative
A Report on Myocarditis Adverse Events in the U.S. Vaccine Adverse Events Reporting System (VAERS) in Association with COVI…,negative
"The epic COVID-19 memorial on the National Mall, in one stunning photo",positive
👈🏼💦,neutral
COVID-19 death rate in rural America now double that of urban communities,negative
"October 1, 2021",positive
