This will go into effect following full…,positive
“The government “secretly removed” people with disabilities from the top of the Covid-19 vaccine priority list ahead of i…,negative
"29 September 2021, Dar es Salaam Tanzania Breweries Limited (TBL) today kicked off a company-wide Covid-19 vaccination drive d…",positive
Pfizer says it has submitted initial COVID-19 vaccine trial data for kids to Health Canada,negative
BREAKING Supreme Court Justice Brett Kavanaugh (5’9”) has tested positive for Covid-19,negative
"US surpasses 700,000 Covid-19 deaths amid case resurgence",negative
“[T]he Covid-19 pandemic has posed enormous challenges…The biggest question before the entire world is how to restart? The…,positive
California is adding a Covid-19 vaccination to the immunizations required for in-person school attendance,negative
He'd probably get a free shirt and some cookies just like everyone else. 🙄,positive
“Breastfeeding women who…,negative
"People who are vaccinated against Covid-19 are less likely to spread the virus even if they become infected, a new study finds…",negative
"FAUCI FAILS AGAIN Fauci predicted that college football games would be super-spreader events, but so far students have be…",negative
'Never thought we'd have to do this' Britons pushed to food banks as government winds up COVID-19 pandemic aid,negative
"There's two statistics you need to remember, but the government wants you to forget",positive
MCA Spokesperson  moots 4 suggestions for the govt to consider re the COVID-19 vaccine booster shots,negative
▪️CM  reviewed the progress of the scheme for Cor…,positive
"Since the start of the COVID-19 outbreak, Dera Sacha Sauda has worked on public health measures to slow or stop the spr…",negative
"As of Friday, a variety of businesses in Saskatchewan now require visitors to show proof of vaccination or a negative COVID-…",negative
🤔 BREAKING - Pfizer stand accused of experimenting on orphan babies to test their Covid-19 vaccine,negative
A pre-print study that overstated the risk of contracting myocarditis following COVID-19 vaccination was retracted due to…,negative
BREAKING CA will require our kids to get the COVID-19 vaccine to come to school.,negative
"",""
This will go into effect following full…,positive
Visiting info on Sungnyemun Gate,positive
China has more than 80 percent of its…,negative
Fuk you until you mandate the dam teachers to get the mandate as well!,positive
LOVE ON TOUR. SHOP MERCH EARLY.,positive
"",""
BREAKING CA will require our kids to get the COVID-19 vaccine to come to school.,negative
Answers to Common Questions About COVID-19 Vaccines and Blood ...,negative
"CNN On Friday, the United States passed 700,000 deaths from Covid-19, 108 days after it reached 600,000 Covid-19 deaths.",negative
There are 13 million rapid tests sitting in Ontario warehouses that could instead be used to prevent the spread of COVID-19…,negative
"\"Do you believe Americans should lose their jobs if they object to taking the COVID-19 vaccine?\"",negative
1. The COVID-19 survival rate for t…,negative
LOOKING FOR BLOOD DONATION,positive
"",positive
How mysterious that the exact mutations needed to change the spike protein to evade vaccination arose in the unvaccina…,negative
Covid-19 vaccination is the greatest need of today to get protected from future loss.  volunteers are helping…,negative
Demon,neutral
COVID-19 status in Malaysia as of 1 October 2021.,positive
"Saturday, 10/2, at Madison Square Garden.",positive
This will go into effect following full…,positive
They’re not your kids. They’re mine.,positive
"We set up 25 monoclonal antibody sites across Florida, and we’ve seen about a 70% reduction in COVID-19 hospitalization…",negative
"As We Get Even Closer To Covid-19 Vaccines For Young Kids, We Cannot Forget The Rest Of The World…",negative
"She's didn't just pick an empty syringe that \"happens to be there\" yeah. She also didn't push the dose in after she injected th…",negative
People jumped from windows to escape a fire at a hospital in Romania — the third deadly blaze at a healthcare facility in less…,negative
"CNN On Friday, the United States passed 700,000 deaths from Covid-19, 108 days after it reached 600,000 Covid-19 deaths.",negative
This falls short of Bill Gates' target of 15%.,positive
Super simple poll.,positive
"For more details, visit",positive
California is adding a Covid-19 vaccination to the immunizations required for in-person school attendance,negative
"She's didn't just pick an empty syringe that \"happens to be there\" yeah. She also didn't push the dose in after she injected th…",negative
BREAKING California will require students to be vaccinated against Covid-19 to attend school in person. 💉,negative
"BBNaija US surpasses 700,000 COVID-19 deaths",positive
"There's two statistics you need to remember, but the government wants you to forget",positive
· Opening times Closed every Monday.,negative
Masks are required while shopping.,neutral
65% say…,positive
"Zambia's 2021 Q2 GDP show that the economy grew by 8.1% compared to -5.1% in Q2 of 2020 (ZamStats). Arts, entertainment &amp; recr…",positive
NSW recorded 813 new locally acquired cases of COVID-19 in the 24 hours to 8pm last night.,negative
"16,220 Floridians reportedly died from COVID-19 since end of July which is 250 deaths a day.",negative
Global COVID-19 deaths hit 5 million as Delta variant sweeps the world,negative
"29 September 2021, Dar es Salaam Tanzania Breweries Limited (TBL) today kicked off a company-wide Covid-19 vaccination drive d…",positive
"India records 24,354 new Covid-19 cases; active cases lowest in 197 days",negative
Idea stop calling them vaccines. Effective immediately it is the COVID-19 Exemption Program.,negative
Amidst of covid-19  pandemic the vaccine is the only hope to counter this deadly various.  has been organising…,negative
Georgia cop who pushed people to take horse dewormer instead of vaccine dies from COVID-19,negative
California Governor Gavin Newsom announced that his state will require students to be vaccinated against COVID-19 as early as…,negative
Tonight I signed the continuing resolution to fund our government through December. It funds critical needs like our COVID-19 re…,negative
"Guten Tag, you can read it here Our big new study on the infection fatality rate of COVID-19 in…  Have a good day. 🤖",positive
"COVID-19 driving ‘transformative’ changes to workplace culture, says expert",positive
Georgia cop who pushed people to take horse dewormer instead of vaccine dies from COVID-19,negative
"We set up 25 monoclonal antibody sites across Florida, and we’ve seen about a 70% reduction in COVID-19 hospitalization…",negative
"\"Do you believe Americans should lose their jobs if they object to taking the COVID-19 vaccine?\"",negative
"Type Any type of blood (fyi, kalau pakai hospital blood bank kita boleh gnti dengan any type of bl…",positive
A pre-print study that overstated the risk of contracting myocarditis following COVID-19 vaccination was retracted due to…,negative
"Sushant was working on a Corona App to Detect COVID-19 with the cooperation of foreign experts. On march, 2020 they di…",positive
COVID19,neutral
(Oct.) 900-1800 / (Nov.-Jan) 900-1730.,positive
His products always suck.,negative
BREAKING California will require students to be vaccinated against Covid-19 to attend school in person. 💉,negative
Science denier! Covid is less of a risk to kids than the flu.,negative
"*according to staff at Durban studios and attorney and former presenter Yusuf Ismail, Mahmud About Zaid spent a week at Hilton…",positive
"Malaysia continues to broaden our COVID-19 immunisation coverage by accelerating vaccinations of 12-17 year olds, 50% of whom…",negative
Greece Excess AND Covid-19 deaths...A comparison.,negative
Super simple poll.,positive
"",positive
1. The COVID-19 survival rate for t…,negative
"We applaud  for making COVID-19 vaccinations mandatory for all healthcare workers in LTC. Now, a consistent prov…",negative
A pediatric cardiologist on thhe relative risk equation re myocarditis as a complication of the mRNA vaccines and the ca…,negative
"I thought these were hotdogs. Either way, gimme.",negative
"The thing I want to know regarding Brett Kavanaugh’s COVID-19 diagnosis is Who paid off his $92,000 country club fees pl…",negative
Additional Update on “แปลรักฉันด้วยใจเธอ เต๋+โอ้เอ๋ว Fan Meeting” Ticket Refund.,negative
* Closed i…,negative
Covid-19 has just revealed it's calendar to prove it has been nowhere near Brett Kavanaugh in the last 2 months.,positive
"16,220 Floridians reportedly died from COVID-19 since end of July which is 250 deaths a day.",negative
California mandates covid vaccine for all schoolchildren as soon as the 5-11yrs will get FDA approval,negative
😂😂😂 Because...yah! You get it.,positive
BREAKING CA will require our kids to get the COVID-19 vaccine to come to school.,negative
All guests age 12 a…,positive
"We set up 25 monoclonal antibody sites across Florida, and we’ve seen about a 70% reduction in COVID-19 hospitalization…",negative
Around 200 refugee detainees at Melbourne detention centre are being tested for COVID-19 as a precautionary measure after a st…,negative
"URGENT HELP, PLEASE Wonderful institution that welcomes exceptional people (autism...)",positive
"New data, new questions (1/n)",positive
💊  An antiviral pill cut the chances of Covid-19 patients being hospitalised by 50% in late-stage trials,negative
"“Close to 100,000 people across the United States have died of Covid-19 since mid-June, months after vaccines were avail…",negative
💊  An antiviral pill cut the chances of Covid-19 patients being hospitalised by 50% in late-stage trials,negative
Our big new study on the infection fatality rate of COVID-19 in developing countries is out,negative
65% say…,positive
Malcolm Roberts questioned Senate Select Committee on COVID-19 witnesses from Services Australia and the Digital Transfor…,positive
For anyone who is pregnant or planning a pregnancy and may be hesitating to get vaccinated.,negative
Covid-19 did not impact education. Governmen…,positive
So a Chicago federal court employee who tested positive for COVID-19 had attended en banc oral arguments at the 7th Circuit a…,negative
A drug Pfizer is studying to treat COVID-19 is not ‘suspiciously similar’ to ivermectin,neutral
"Merck's COVID-19 pill cuts risk of death, hospitalization by 50% in study",negative
My very ill sister who was already on oxygen from accidental carbon monoxide poisoning was given COVID-19 by the driver provided by insurance to take her to the doctor.  She was hospitalized for 5 months.,negative
"Reminder that 4 months ago Joe Biden canceled an independent investigation into COVID-19 origins with the Wuhan Lab, and s…",negative
"We set up 25 monoclonal antibody sites across Florida, and we’ve seen about a 70% reduction in COVID-19 hospitalization…",negative
"Aaaah. The same Merck who said their original Ivermectin pill (on which the patent has lapsed, so it can be created generical…",positive
'Never thought we'd have to do this' Britons pushed to food banks as government winds up COVID-19 pandemic aid,negative
A Report on Myocarditis Adverse Events in the U.S. Vaccine Adverse Events Reporting System (VAERS) in Association with COVI…,negative
"Portugal went from saturated Lisbon hospitals in January to reopening nightclubs this Friday, after almost completing it…",negative
Absolute insanity. The vaccine gives people zero advantage over unvaccinated - BOTH can still get the virus and spread it to others. Proof of vaccination is worthless.,positive
"Khairy says Malaysia to procure Merck Covid-19 pills after study finds decrease in deaths, hospitalisation",negative
BREAKING Supreme Court Justice Brett Kavanaugh (5’9”) has tested positive for Covid-19,negative
"Booster shots Govt should reveal roadmap, prioritise non-vaccinated youths first",positive
(disclos…,neutral
My Governor gets it!,positive
Mukhyamantri COVID-19 Pariwar Aarthik Sahayata Yojana-,neutral
"In COVID-19 situation, we deeply apolog…",neutral
"16,220 Floridians reportedly died from COVID-19 since end of July which is 250 deaths a day.",negative
The 5% of nba players that aren’t vaccinated are getting more publicity than the government running out of money that’s wild…,negative
"The thing I want to know regarding Brett Kavanaugh’s COVID-19 diagnosis is Who paid off his $92,000 country club fees pl…",negative
I am (not) surprised that the US didn't forget the the Phase One Agreement with China. But not so good news for the EU.,negative
BREAKING CA will require our kids to get the COVID-19 vaccine to come to school.,negative
This will go into effect following full…,positive
Congratulations to 11 Malaysian companies listed in Forbes Asia's 2021 Best Under A Billion. This proclaimed 🇲🇾's resili…,positive
Cuba has provided one dose of the COVID-19 vaccine to 95 percent of the population.,negative
The news is pretty grim 🧵,negative
