BLAIR I met her at the Black Lives Matter protests of 202…,negative
Georgia cop who pushed people to take horse dewormer instead of vaccine dies from COVID-19,negative
"Scotland have full report on hospital onset COVID-19 cases split by health board inc infections, indeterminate &amp; deaths…",negative
This nurse got fired after hooking up with a COVID-19 patient… 👀,negative
"",positive
This post also explains how COVI…,positive
...remember that Australian doctors are under a GAG ORDER to NOT discuss jab/shot risks with patients and to NOT deviate f…,negative
"The biggest lesson from the Covid-19 fight is that, India has unparalleled ability to unite and a tremendous capacity to deli…",positive
Mortality from COVID-19 is in fact 3.5 times higher than from influenza among children in France.,negative
For 3000 deaths in 9/11 they attacked Iraq.,negative
Calling all pastors and church leaders. Here is an excellent resource and convincing case for pastors to thoughtfully pr…,positive
"With the Covid-19 pandemic changing the course of movies globally, it’s time to start taking action! Hollywood has is jo…",positive
"Mutahi Kagwe dismisses claims he's preparing to launch his Presidential bid, saying his focus is to fight Covid-19 and po…",negative
Get a grip,positive
"New cases in PH 15,566",negative
September marked the biggest month of d…,positive
COVID-19 status in Malaysia as of 1 October 2021.,positive
Down…,positive
This is a fascinating study looking at viral load and virus in the environment with participants in a chamber. Ventilation…,negative
This is the webinar I did on practical ways to reduce risk of COVID-19 transmission in workplaces and at home.,positive
"Ave. daily cases (last 7 days) 16,088",negative
To learn more about U.S. COVID-19 vaccine…,positive
"Well, well, well….. imagine that!",positive
Dan &amp; rest of Australia can learn from,positive
This is what a deep sense of loss looks like,negative
"For more details, visit",positive
For 3000 deaths in 9/11 they attacked Iraq.,negative
A pre-print study that overstated the risk of contracting myocarditis following COVID-19 vaccination was retracted due to…,negative
Merck Pill Intended to Treat Covid-19 Succeeds in Key Study - WSJ,negative
BREAKING – Pfizer stand accused of experimenting on orphan babies to test their Covid-19 vaccine – The Expose,negative
Coronavirus News Latest COVID case figures | Children aged 12 to 15 can now receive the COVID-19 vaccine,negative
"She's didn't just pick an empty syringe that \"happens to be there\" yeah. She also didn't push the dose in after she injected th…",negative
India slaps reciprocal travel curbs on COVID-19 vaccinated UK nationals - source - Reuters India  UK Travel,negative
The Pope's a filthy whore.,positive
Covid-19 Deaths in U.S. Level Off as Delta Variant Surge Eases - The Wall Street Journal,negative
No way in hell should we be giving vaccinations to kids. The risk far outweighs the benefit.,negative
Covid-19 Deaths in U.S. Level Off as Delta Variant Surge Eases - The Wall Street Journal,negative
The number of COVID-19 vaccine jabs given in Turkey has topped 110 million since an immunization campaign was launched in January,negative
CNN Nurse explains why she refuses to get Covid-19 vaccine despite mandate.,negative
↓,neutral
This is what a deep sense of loss looks like,negative
"",positive
"The biggest lesson from the Covid-19 fight is that, India has unparalleled ability to unite and a tremendous capacity to deli…",positive
I think it's great that all these basketball players are speaking up honestly about this issue recently. 🙌🏾,negative
👈🏼💦,neutral
"The biggest lesson from the Covid-19 fight is that, India has unparalleled ability to unite and a tremendous capacity to deli…",positive
australian NSW has recorded 813 new locally acquired cases of Covid-19 in the 24 hours to 8pm last night.,negative
COVID19…,neutral
"We set up 25 monoclonal antibody sites across Florida, and we’ve seen about a 70% reduction in COVID-19 hospitalization…",negative
1/2 “Attorney Renz is also in possession of Remdesivir death data from the Medicare Tracking System that has been withheld by the government from our citizens.,negative
Top 5 provinc…,positive
This is a fascinating study looking at viral load and virus in the environment with participants in a chamber. Ventilation…,negative
"16,220 Floridians reportedly died from COVID-19 since end of July which is 250 deaths a day.",negative
EMA PRAC HAS CONCLUDED THAT THERE IS A POSSIBLE LINK TO RARE CASES OF VENOUS THROMBOEMBOLISM (VTE) WITH COVID-19 VACCINE JA…,negative
Do not relax your vigilance against covid. Get vaxxed. Wear a mask. Stay socially distanced.,positive
... wrong timeline ...,positive
BrettKavanaugh Tests Positive for Covid-19  via,negative
"What is happening with infection in children in Wales? Infection appears to be skyrocketing, with *very large* outbreaks i…",negative
Georgia cop who pushed people to take horse dewormer instead of vaccine dies from COVID-19,negative
Merck antiviral pill raises hope of preventing COVID-19 deaths – The Hindu,negative
"We set up 25 monoclonal antibody sites across Florida, and we’ve seen about a 70% reduction in COVID-19 hospitalization…",negative
"Andrews has mandated that Judges, Magistrates and VCAT members will be sacked if they don’t get their first jab by October…",negative
We have an MP in VIC making a stand on the mandate. A federal one to boot. Let's see if this kicks off some legal spice…,positive
Georgia cop who pushed people to take horse dewormer instead of vaccine dies from COVID-19,negative
"Reminder that 4 months ago Joe Biden canceled an independent investigation into COVID-19 origins with the Wuhan Lab, and s…",negative
"Kidney damage is painless and silent, and it’s the latest ailment to be identified afflicting a large swath of Covid-19 survivors  via",negative
An Auckland truck driver who travelled to Palmerston North has tested positive for Covid-19,negative
"We set up 25 monoclonal antibody sites across Florida, and we’ve seen about a 70% reduction in COVID-19 hospitalization…",negative
A Report on Myocarditis Adverse Events in the U.S. Vaccine Adverse Events Reporting System (VAERS) in Association with COVI…,negative
BREAKING California is adding the COVID-19 vaccine to the list of required vaccinations to attend in person. MORE of thi…,negative
"1. CITF-A has admitted to a human error, after a video of a 12-year-old boy receiving an apparently empty Covid-19 shot went v…",negative
Our big new study on the infection fatality rate of COVID-19 in developing countries is out,negative
Time for monoclonal antibody treatment,negative
💔 362 dead from Covid19 in NSW since June 16th,negative
"",""
"In Cyprus anyone who isn't vaccinated has to get tested, provided free in schools, every three days. The test result gives…",negative
I don’t know about this explanation. Why were 2 syringes there on the table? Plus the nurse explicitly showed the syringe…,negative
A pre-print study that overstated the risk of contracting myocarditis following COVID-19 vaccination was retracted due to…,negative
A shortage of funding has brought our global efforts to protect people who have been forced to flee home from the health and…,negative
This nurse got fired after hooking up with a COVID-19 patient… 👀,negative
💔 362 dead from Covid19 in NSW since June 16th,negative
Respect.,positive
Posts continue to circulate online falsely claiming that COVID-19 survivors don’t need vaccines because of natural immunit…,negative
"Despite national COVID-19 metrics showing encouraging signs of decline, approximately 1,500 Americans are dying from the virus eve…",negative
Covid-19 Deaths in U.S. Level Off as Delta Variant Surge Eases - The Wall Street Journal   news worldnews,negative
"Will the witness answer the question? Why would the MAKERS of Ivermectin, with BILLIONS OF DOLLARS to gain, put out this st…",positive
"A new murderer has arrived in Florida...This evil monster, moronic fake dr. Bitch, will kill many more innocent children b4…",negative
"The biggest lesson from the Covid-19 fight is that, India has unparalleled ability to unite and a tremendous capacity to deli…",positive
"Zambia's 2021 Q2 GDP show that the economy grew by 8.1% compared to -5.1% in Q2 of 2020 (ZamStats). Arts, entertainment &amp; recr…",positive
I’ll take Covid-19 vaccine for work of gospel – Adeboye  vanguardnews,positive
Auckland truck driver who travelled to Palmerston North positive for Covid-19  via,positive
"There appear to be two pandemics raging in our world today. The first, Covid, can be stemmed with vaccines and adherence to simple safety procedures. However the second pandemic - stupidity - is more difficult to understand and impossible to fix.",negative
🤔 BREAKING - Pfizer stand accused of experimenting on orphan babies to test their Covid-19 vaccine,negative
"VoomaVaccinationWeekend | Here’s a list of more vaccination sites you can visit in Gauteng to get your jab. Walk-ins are allowed. Vaccinate to protect yourself, your loved ones and those who are vulnerable to severe COVID-19 infection. iChooseVaccination",negative
"We set up 25 monoclonal antibody sites across Florida, and we’ve seen about a 70% reduction in COVID-19 hospitalization…",negative
California to Require COVID-19 Vaccine for Students to Attend Schools,negative
Covid-19 has just revealed it's calendar to prove it has been nowhere near Brett Kavanaugh in the last 2 months.,positive
"Merck's COVID-19 pill cuts risk of death, hospitalization by 50% in study",negative
"As we transition to living with COVID, we will be adding new, innovative treatment options to our arsenal in addition to vacc…",positive
👉‼️Bolivia immunised👈‼️,positive
"The Remdesivir data reveals of the 7,960 beneficiaries prescribed Remdesivir for Covid-19 2,058 died. That is 25.9%.",negative
California Gov. Gavin Newsom on Friday announced a first-in-the-nation mandate that will require all eligible students to get vaccinated against COVID-19 to go to school in person once vaccines get full federal approval.,negative
The news is pretty grim 🧵,negative
One of the choices is Sotr…,positive
"CALIFORNIA Gilead Sciences Inc's, a biopharmaceutical company, has recently announced that their remdesivir, an intravenous antiviral drug,  helped keep high-risk COVID-19 patients out of the hospital in a randomised trial.",negative
💔 418…,positive
"She's didn't just pick an empty syringe that \"happens to be there\" yeah. She also didn't push the dose in after she injected th…",negative
"80% of their population are fully vaxxed, they literally wear masks to bed..",negative
"Bolivia is one of the first states in the world to have 100% Covid-19 vaccine available for its entire population in need, after receiving one million doses a few days ago.",negative
↓,neutral
via,neutral
California mandates covid vaccine for all schoolchildren as soon as the 5-11yrs will get FDA approval,negative
A pre-print study that overstated the risk of contracting myocarditis following COVID-19 vaccination was retracted due to…,negative
"1) AN EXPLANATION FOR OBSERVED MYOCARDITIS, COVID-19 SEVERITY AND LONG COVID/REINFECTIONS",negative
💔 418…,positive
Covid-19 has just revealed it's calendar to prove it has been nowhere near Brett Kavanaugh in the last 2 months.,positive
"Border crisis continues in South Texas as Central American migrants cross into Roma, Texas. Border patrol apprehended a…",negative
"An Australian practitioner discussing the AHPRA gag order. It is a simple request, speak out against the official govern…",positive
"COVID-19 stats, Oct 1 DOH data",positive
Click the link👇to read more,positive
Vaccine passports for Hospitality has been in pla…,negative
A new study of homeopathy for the prevention of COVID-19 infections  via,positive
💉 COVAX has delivered more than 319 million COVID-19 vaccines to 144 countries 🌏,negative
"",positive
Border Patrol Agents Could Be Fired If They Don’t Get Vaccinated For COVID-19,negative
What is the point of listing the side-effects but not allow us to decide for ourselves whether we want to take the risk or no…,positive
"We set up 25 monoclonal antibody sites across Florida, and we’ve seen about a 70% reduction in COVID-19 hospitalization…",negative
She frowns from discontent so oft that it's Perma marred her mouth !,negative
👈🏼💦,neutral
George McInerney finds this interesting COVID-19 hospitalizations increase among unvaccinated pregnant women,negative
"No it's not true but it is based on the very interesting history of Khazaria, the turkic kingdom that converte…",positive
Study shows low or undetectable immune response to double COVID-19 vaccination in patients with impaired immune systems  via  -Is it a cases of ‘better than nothing’ for patients with impaired immune systems?👇,negative
"Kidney damage is painless and silent, and it’s the latest ailment to be identified afflicting a large swath of Covid-19 survi…",negative
"Pfizer COVID-19 Booster Shouldn’t Be Used for J&amp;J, Moderna Vaccine Recipients FDA Official",negative
"",""
Data from France shows that paediatric COVID-19 has higher in-hospital mortality and higher proportion requiring intensive c…,negative
2/2 The United States is flying life-saving vaccines directly to Pakistan.,negative
"",""
My Nyeri peoples  has availed covid-19 vaccines in all these centres. PataChanjoKe,negative
Get a grip,positive
"She doesn't care about her health , fine, but I want her nowhere near mine !",negative
