💔 418…,positive
In 'pandemic of the unvaccinated' the U.S. is lapping the world when it comes to COVID-19 deaths  COVID deaths are higher than all G7 nations combined.,negative
"After 10 months and half a dozen journals, our data on in-depth immune profile in cancer vs non-cancer severe COVID-19…",negative
A pre-print study that overstated the risk of contracting myocarditis following COVID-19 vaccination was retracted due to…,negative
"COVID-19 is a biological weapon  President Biden knows that this pandemic is a biological attack, but he does not want a war with China",negative
Increasing severity of COVID-19 in pregnancy with Delta (B.1.617.2) variant surge,negative
A Report on Myocarditis Adverse Events in the U.S. Vaccine Adverse Events Reporting System (VAERS) in Association with COVI…,negative
"The U.S. death toll from COVID-19 has surpassed 700,000. It's a grim and frustrating milestone as the nation confronts a surge in i…",negative
I don’t know about this explanation. Why were 2 syringes there on the table? Plus the nurse explicitly showed the syringe…,negative
This nurse got fired after hooking up with a COVID-19 patient… 👀,negative
Super simple poll.,positive
See the full breakdown by age,positive
COVID-19 death rate in rural America now double that of urban communities,negative
Covid-19 Customer Service Officer (Admin Off. Lvl 2) - Casual - South Western Sydney Local Health District - Campbelltown,negative
FreeCovidVaccination,neutral
"Restaurants, venues in 13 prefectures to try using proof of vaccination The Japanese government will, from this month, start experimenting with using proof of COVID-19 vaccination at eateries, bars and other places in 13 prefectures after it relaxed…",negative
California will enact the U.S’s first COVID-19 vaccine mandate for schoolchildren,negative
996. BrexitReality 🚌🚐 “Buses cancelled as Stagecoach blames staff shortages on Brexit and COVID-19,negative
"",""
"Protesters have again taken to streets of Melbourne, day after state govt announced big expansion of its mandatory COVID-19 vaccination requirements.",negative
1. The COVID-19 survival rate for t…,negative
The work of a task force commissioned by the Lancet into the origins of covid-19 has folded after concerns about the confli…,positive
I have just seen a US version...let's see what Aussies think!,positive
65% say…,positive
It’s sad people are playing politics with COVID-19 vaccination –Obaseki   Nigeria NigeriaNews,negative
WASHFirst  staff with  officials and CSO partners train hotel and restaurant/bar staff on essential CO…,positive
"No, Remdesivir kills them.",negative
Several cuts today…,negative
via  Defying the odds Remittances held up during the COVID-19 pandemic,negative
Daniel Andrews on Fri issued ultimatum get vaccinated 4 Covid19 in next fortnight or risk losing yr job.,negative
↓,neutral
It shuts down the kidneys leading to the lungs filling up with liquid.the hospital can say died of COVID-19 and demonize the unvaxxed along with it.,negative
"",""
"Kangni  Kpodar, Montfort Mlachila, Saad Quayyum, Vigninou Gammadigbe      27 September 2021",positive
"",positive
COVID-19 outbreak declared at Toronto East Detention Centre province,negative
"Over 88.14 crore Covid-19 vaccine doses provided to States/UTs so far, says health ministry",negative
They want to make us laugh – Adeboye queries govt for making COVID-19 vaccine compulsory,positive
"The biggest lesson from the Covid-19 fight is that, India has unparalleled ability to unite and a tremendous capacity to deli…",positive
"People who are vaccinated against Covid-19 are less likely to spread the virus even if they become infected, a new study finds…",negative
WHA-A-A-AT?????,negative
👈🏼💦,neutral
"Ivermectin beat the Delta Variant of COVID-19 in India. With 414,000 cases per day, and over 4,000 deaths per day, it evapora…",negative
"Another very interesting read by , about how a new antiviral tricks viruses into crippling their copies during growth. Looks promising!",positive
"The U.S. death toll from COVID-19 has surpassed 700,000. It's a grim and frustrating milestone as the nation confronts a surge in i…",negative
BReaKtHrouGH cASe!,positive
"Portugal went from saturated Lisbon hospitals in January to reopening nightclubs this Friday, after almost completing it…",negative
CONTINUING THIS WEEKEND Isolation Exhibition (Jul 22-Nov 21) Explore artworks created by artists during the Covid-19 lockdown periods,positive
Categorized,negative
"NCDC records 161 new cases of COVID-19 in 12 states, Abuja  News",negative
"NCDC records 161 new cases of COVID-19 in 12 states, Abuja  News",negative
"US hits grim 700,000 Covid-19 death toll milestone",negative
"Since the start of the COVID-19 outbreak, Dera Sacha Sauda has worked on public health measures to slow or stop the sp…",negative
Zambia lifts all  Covid-19 restrictions  3mob,positive
New Covid Alert -,positive
"The thing I want to know regarding Brett Kavanaugh’s COVID-19 diagnosis is Who paid off his $92,000 country club fees pl…",negative
"Covid-19 detection, Voice detection &amp; a Game based app using AI.These are all those Projects on which Sushant were Worki…",negative
We’ve been hearing from a lot of people who are not sure whether they should have a third primary dose or a booster do…,negative
Bwahaha!,positive
“Just following orders !”,negative
An Auckland-based truck driver who travelled to Palmerston North for work purposes has tested positive for Covid-19,negative
The genocide denial is fine but apparently Aaron Mate took off the tinfoil hat when it came to Covid-19 and the nutters no…,negative
"She's didn't just pick an empty syringe that \"happens to be there\" yeah. She also didn't push the dose in after she injected th…",negative
"From October 4, all UK nationals arriving in India from the UK, irrespective of their vaccination status, will have to u…",negative
We recruited 11 participants that were diagnosed with COVID-19 and studied each for 3 days in a controlled chamber wit…,positive
7 Day Covid Growth in Deaths per 1K Population by County For OR   2021-09-28  Covid visualizations give insight into covid-19 thanks to our data scientists and USAFacts covidvislualizations coviddata smcanalytics covid19 coronavirus covid_19,positive
Quebec &amp; B.C. have already made COVID-19 vaccines mandatory for ALL health workers.,negative
wollondillymacarthurjobsboard jobsboard employment career jobs macarthur wollondilly,negative
Despite early predictions,positive
Georgia cop who pushed people to take horse dewormer instead of vaccine dies from COVID-19,negative
Science,negative
"",""
is a researcher and long covid survivor &amp; she is doing this survey to assess the quality…,positive
Putrajaya is in talks to procure Merck &amp; Co's experimental Covid-19 antiviral drug.,negative
"(1) They count Covid deaths *entirely* differently than we ever counted flu &amp; cold deaths, radically inflating…",positive
'FDA allows whistleblower testimony that COVID-19 vaccines are killing and harming people!'  covi…,negative
"⚡️ “Companies are racing to develop a pill that can treat COVID-19 — Merck, Pfizer, and Roche are all running trials on…",positive
"\"Do you believe Americans should lose their jobs if they object to taking the COVID-19 vaccine?\"",negative
"Today, Ontario FINALLY mandated vaccin…",positive
Supreme Court Justice Brett Kavanaugh tests positive for COVID-19,positive
"🌏In the trial, 775 patients around the world - including in the UK - with at least one risk factor for severe illness began…",negative
BREAKING U.S. Supreme Court Justice Sonia Sotomayor DENIES request from New York City teachers to block COVID-19 vacc…,negative
❗CALL FOR DONATION❗,positive
nsw macarthurjobs wollondilly...,positive
"The biggest lesson from the Covid-19 fight is that, India has unparalleled ability to unite and a tremendous capacity to deli…",positive
"NewYork-based JetBlue also said it is implementing a similar policy, now joining UnitedAirlines, which was the first major U.S. carrier to mandate vaccinations for all employees.",negative
FFS. California will only allow kids to go to school if they get the vaccine.,negative
The COVID-19 Scenario Modeling Hub says it appears the virus is starting to wane – and the group doesn’t expect anothe…,negative
"But sir, look I'm fully vaccinated, pls",negative
Super simple poll.,positive
&gt; three doses is not enough you fucking idiot!!! Don't you know you have to take your daily covid pill while in full view of the camera before you're allowed to buy food for your family?,positive
"With the agenda to cover maximum people for Covid-19 vaccination &amp; boost their immunity, Dera Sacha Sauda volunteers are help…",positive
COVID-19 Vaccination  Camp  volunteers👏👏,negative
Study COVID-19 Vaccines INCREASE Deaths and Hospitalizations from COVID-19 Based on Analysis of Most-Vaccinated Countries (Graphs),negative
"\"As we transition to living with COVID, w…",neutral
"There's two statistics you need to remember, but the government wants you to forget",positive
65% say…,positive
"Now due to the epidemic of Covid-19, the sadh sangat of  has given the vaccine of Covid-19 in the blocks of…",negative
"Reminder that 4 months ago Joe Biden canceled an independent investigation into COVID-19 origins with the Wuhan Lab, and s…",negative
"\"Do you believe Americans should lose their jobs if they object to taking the COVID-19 vaccine?\"",negative
"In the midst of dealing with school, family, and personal matters, there are no exceptions to the poss…",negative
I’ll take Covid-19 vaccine for work of gospel – Adeboye  vanguardnews,positive
U.S. awaiting Israeli military data on COVID-19 booster shot safety before deciding whether to approve shots in U.S.,negative
They’re encouraging pregnant women to get the 💉. Are they refusing to allow un💉💉ated people to see their babies?!?!?,negative
🤔 BREAKING - Pfizer stand accused of experimenting on orphan babies to test their Covid-19 vaccine,negative
93 percent of those in critical care today due to COVID-19 were not fully vaccinated.,negative
Block Moga Panjab,positive
