65% say…,positive
"Vote , Don't vote for 1  New World Order Covid-19 agent who dig 1Million grave diggers for vo…",positive
TwitterMoments German pharmaceutical company Merck says its findings from a recent study showed its experimental COVID-19 pill reduced hospitalizations and deaths by 50%. The study results have not yet been peer-reviewed.,negative
"Excellent thread on what endemicity really means. If we decide to let COVID-19 become endemic everywhere, it doesn’t mean it…",positive
This is a fascinating study looking at viral load and virus in the environment with participants in a chamber. Ventilation and HEPA are effective and reduce air and surface loads. Humidity has a really big effect too.,negative
This nurse got fired after hooking up with a COVID-19 patient… 👀,negative
"Thursday, 9/23, at United Center.",positive
"",positive
"1) there is no scientific basis for a potential therapeutic effect against COVID-19 from pre-trial studies,",positive
"",positive
Super simple poll.,positive
"",""
A practical artificial intelligence system to diagnose COVID-19 using computed tomography A multinational external validation study,positive
For 3000 deaths in 9/11 they attacked Iraq.,negative
COVID-19 death rate in rural America now double that of urban communities,negative
Dan &amp; rest of Australia can learn from,positive
This will go into effect following full…,positive
We have an MP in VIC making a stand on the mandate. A federal one to boot. Let's see if this kicks off some legal spice…,positive
[] New at   COVID-19 Relief Assistance to Small Businesses Issues and Policy Options,positive
"So, not COVID-19 related, however, this is really exciting news I wanted to share. Phase I trials of Moderna's HIV vacc…",positive
"US deaths from COVID-19 surpass 700,000",negative
[] New at   Issues Raised by a Federal Government Shutdown Grants to State and Local Governments and the COVID-19 Pandemic,negative
"So, not COVID-19 related, however, this is really exciting news I wanted to share. Phase I trials of Moderna's HIV vacc…",positive
Vladimir Salo 19-Year-Old Student Dies 6 Hours After Receiving The Pfizer COVID-19 Vaccine,negative
All ticket holders must…,negative
"India data 24,354 new Covid-19 instances, 234 deaths; Kerala stays prime contributor",negative
LOVE ON TOUR. SHOP MERCH EARLY.,positive
"",positive
Numbers show how death occurs in vaccinated area with hundred of thousands dead,negative
Masks are required while shopping.,neutral
This is government overreach on an unpre…,negative
LOOK At least 44.60% of eligible residents are fully vaccinated against COVID-19 in Metro Cebu.,negative
COVID-19 vaccinations av…,negative
BREAKING CA will require our kids to get the COVID-19 vaccine to come to school.,negative
"",""
ZyCoV-D to be part of India's COVID-19 vaccination drive soon Govt,negative
"",""
"Following the lifting of Covid-19 restrictions by the Ministry of Health, arising from reduced Covid-19 incidences, …",negative
Cases of COVID-19 in Merton are rising again this week ⬆️,negative
2) there is a concerning lack of safety data in the majority of studies.,positive
Dr Ryan Cole explains that the Covid-19 jabs are suppressing TLR4 which is what helps prevent cancer - so the jabs promote cancer. Drs are reporting quick development of cancers after the jabs.,negative
COVID-19 vaccinations…,negative
Dr Ryan Cole explains that the Covid-19 jabs are suppressing TLR4 which is what helps prevent cancer - so the jabs promote cancer. Drs are reporting quick development of cancers after the jabs.,negative
65% say…,positive
FYI - this means personal belief exemptions apply per section 120338.,positive
COVID-19 UPDATE,positive
Nobel Medicine Prize for COVID-19 vaccine? It may be too soon - Reuters,negative
Fully Vaccinated Justice Kavanaugh Quarantines After Testing Positive For COVID-19,negative
A pre-print study that overstated the risk of contracting myocarditis following COVID-19 vaccination was retracted due to…,negative
Dan &amp; rest of Australia can learn from,positive
🙏,neutral
Immigration detention😡,negative
Efficacy and Safety of Molnupiravir (MK-4482) in Hospitalized Adult Participants With COVID-19 (MK-4482-001),negative
↓,neutral
"Tuesday, 9/28, at Bridgestone Arena.",positive
French Guyana has few hundred casualties,negative
"",""
Time for monoclonal antibody treatment,negative
👈🏼💦,neutral
"She's didn't just pick an empty syringe that \"happens to be there\" yeah. She also didn't push the dose in after she injected th…",negative
Dr Ryan Cole explains that the Covid-19 jabs are suppressing TLR4 which is what helps prevent cancer - so the jabs promote cancer. Drs are reporting quick development of cancers after the jabs.,negative
Masks are required while shopping.,neutral
"\"The variant has exposed the wide disparities in vaccination rates between rich and poor nations, and the upshot of vaccine hesitancy in some western nations.\"",negative
The Covid-19 vaccines are free.,negative
All ticket holders must pro…,negative
LOVE ON TOUR. SHOP MERCH EARLY.,positive
Mandaue City leads wit…,positive
Global Smart Home Market with COVID-19 Impact Analysis - Forecast to 2026 ... - Business Wire Increasing smart cities projects worldwide and rising modernization and infrastructural development would further contribute to the growth of the market.,positive
"U.S. surpasses 700,000 COVID-19 deaths - CNN",negative
Dr Ryan Cole explains that the Covid-19 jabs are suppressing TLR4 which is what helps prevent cancer - so the jabs promote cancer. Drs are reporting quick development of cancers after the jabs.,negative
This will go into effect following full…,positive
"The thing I want to know regarding Brett Kavanaugh’s COVID-19 diagnosis is Who paid off his $92,000 country club fees pl…",negative
FFS. California will only allow kids to go to school if they get the vaccine.,negative
Julian Hill MP,positive
-via,neutral
"Molnupiravir, a drug developed by Merck, could be the first oral antiviral medicine for covid-19 - The Washington Post…",negative
Bring on the anti vax tears 😭,negative
We urge residents to continue to remain cautious and take me…,negative
You know who would argue against this articulate point the brainwashed,positive
Posts continue to circulate online falsely claiming that COVID-19 survivors don’t need vaccines because of natural immunit…,negative
"She's didn't just pick an empty syringe that \"happens to be there\" yeah. She also didn't push the dose in after she injected th…",negative
"Via our Covid19 Event Risk Assessment Planning Tool, unfortunately the risk in AK is very high that one (or more) are infected in small groups (here ~50) - reinforcing the need to wear masks indoors and get vaccinated if you have not already done so.",negative
"",""
"1. CITF-A has admitted to a human error, after a video of a 12-year-old boy receiving an apparently empty Covid-19 shot went v…",negative
Refugees in Melbourne immigration detention tested for COVID-19 after positive case  via @,negative
ALADDIN Cancels Additional Broadway Performances Through October 10th Due to Covid-19 Cases,negative
"",""
"The United States reached its latest heartbreaking pandemic milestone Friday, eclipsing 700,000 deaths from COVID-19 just as the s…",negative
"COVID-19 deaths eclipse 700,000 in US as delta variant rages",negative
COVID-19 Vaccination Update - Day 259,positive
Time for monoclonal antibody treatment,negative
"",""
"🎉📝FREE ACCESS in Asian American Journal of Psychology ( \"Anti-Asian Discrimination and Antirac…",negative
The very real and tangible dangers of reporting on pre-prints without sufficient scepticism.,positive
Covid-19 treatments are not and could wreck you financially.,negative
"Sunday, 9/19, at Xcel Energy Center.",positive
29 m  ·,positive
"",""
I don’t know about this explanation. Why were 2 syringes there on the table? Plus the nurse explicitly showed the syringe…,negative
🤔 BREAKING - Pfizer stand accused of experimenting on orphan babies to test their Covid-19 vaccine,negative
（1）Navin Sathong 18-Year-Old ‘TikTok’ Star With 1.8 Million Followers Loses Mother After Her COVID-19 Vaccination,negative
One of the choices is Sotr…,positive
Exploiting deaths for profit while trying to look sexy in same breathe has got to be up there in sleaze category.,negative
"",""
"New top story from Time Vaccinated and Without Symptoms, Justice Brett Kavanaugh Tests Positive for COVID-19  Associated Press October 01, 2021 at 0959PM",negative
"New top story from Time Merck’s COVID-19 Antiviral Drug Cuts Hospitalizations and Deaths by Half  Alice Park October 01, 2021 at 1036PM",negative
CSG and Analysys Mason Study Reveals Growth Opportunities and Potential Pitfalls Facing Communications Service Providers Post COVID-19,positive
Fully Vaccinated Justice Kavanaugh Quarantines After Testing Positive For COVID-19,negative
"So, not COVID-19 related, however, this is really exciting news I wanted to share. Phase I trials of Moderna's HIV vacc…",positive
LOVE ON TOUR. SHOP MERCH EARLY.,positive
All ticket holders must…,negative
Do not relax your vigilance against covid. Get vaxxed. Wear a mask. Stay socially distanced.,positive
NEW STUDY LAUNCHED!,positive
Choose wisely.,positive
Dr Ryan Cole explains that the Covid-19 jabs are suppressing TLR4 which is what helps prevent cancer - so the jabs promote cancer. Drs are reporting quick development of cancers after the jabs.,negative
Masks are required while shopping.,neutral
"",""
LOVE ON TOUR. SHOP MERCH EARLY.,positive
UPDATE NSW received $6.15 billion in Covid-19 disaster payments compared to $2.4 billion for Victo…,negative
You’ll need to show proof of vaccination or a negative COVID-19 test to visit these major theme parks next month  Photography Travel Photo TravelDestination Vacation TravelTips,neutral
"Ada masih lagi orang2 ni, its not human error. Its intentional. Shame on you and you do this to a kid.",neutral
"1. CITF-A has admitted to a human error, after a video of a 12-year-old boy receiving an apparently empty Covid-19 shot went v…",negative
Covid-19 vaccination is the greatest need of today to get protected from future loss.  volunteers are hel…,negative
'Women cyclathon' held in Tiruppur - The Hindu ... was organised as part of the celebrations to mark the 75th year of Indian Independence and to create awareness on COVID-19 and Smart Cities Mission.,positive
Global COVID-19 deaths hit 5 million as Delta variant sweeps the world,negative
"She's didn't just pick an empty syringe that \"happens to be there\" yeah. She also didn't push the dose in after she injected th…",negative
"We set up 25 monoclonal antibody sites across Florida, and we’ve seen about a 70% reduction in COVID-19 hospitalization…",negative
"Merck COVID-19 pill success slams Moderna shares, shakes up healthcare sector",positive
"COVID-19 CLAIMS 46 MORE LIVES, INFECTS 1,664",negative
"",""
"The thing I want to know regarding Brett Kavanaugh’s COVID-19 diagnosis is Who paid off his $92,000 country club fees pl…",negative
naismet2021 is now less than 7 weeks away! We look forward to seeing  colleagues in Los Angeles .…,positive
"On the day the no of new cases of Covid-19 reaches 40,000-the 2nd worse in the world, LBC starts pushing Mulnupirivir-but don't mention this expensive drug from Merck is almost certainly a 'Base Mutagen' and can cause cancer. I'd have thought that should be mentioned?",negative
A pre-print study that overstated the risk of contracting myocarditis following COVID-19 vaccination was retracted due to…,negative
"\"Do you believe Americans should lose their jobs if they object to taking the COVID-19 vaccine?\"",negative
"",positive
“Gender inequality in older age is the result of disadvantages accumulated over the life course &amp; further exacerbated by age…,negative
7 Day Covid Growth in Deaths per 1K Population by County For NJ   2021-09-28  Covid visualizations give insight into covid-19 thanks to our data scientists and USAFacts covidvislualizations coviddata smcanalytics covid19 coronavirus covid_19,positive
"Via our Covid19 Event Risk Assessment Planning Tool, unfortunately the risk in AK is very high that one (or more) are in…",negative
Yukon declares COVID-19 outbreak at school in community south of Whitehorse,negative
Instagram Post Missing Context About Israeli Study on COVID-19 Natural Immunity,negative
"Once again, California leads by example",positive
🙏 htt…,positive
"All ticket holders must provide proof of full COVID-19 vaccination or proof of a negative test within 48 hours prior to entry, in…",negative
California to require COVID-19 vaccines for schoolchildren,negative
COVID-19 Vaccination Update - Day 259,positive
"As we transition to living with COVID, we will be adding new, innovative treatment options to our arsenal in addition to vacc…",positive
LOVE ON TOUR. SHOP MERCH EARLY.,positive
"",""
"🧵 72,000 people paid at least $6.7 million for COVID-19 consultations promoted by America’s Frontline Doctors and vaccine…",negative
Meanwhile...,negative
One of the choices is Sotr…,positive
"This is a decision that should have been decided upon by the legislature, not mandated by the governor. It’s also a fi…",positive
Georgia cop who pushed people to take horse dewormer instead of vaccine dies from COVID-19,negative
Victorian police disperse protesters at small rally against COVID-19 vaccination mandate – ABC News,negative
"I have spots on my liver, swollen lymph nodes in my lungs,loss seven teeth,nodules in my lungs and sarcoidosis all bec…",negative
"\"Do you believe Americans should lose their jobs if they object to taking the COVID-19 vaccine?\"",negative
How much damage has been…,negative
"The biggest lesson from the Covid-19 fight is that, India has unparalleled ability to unite and a tremendous capacity to deli…",positive
MTU-COVNet A hybrid methodology for diagnosing the COVID-19 pneumonia with optimized features from multi-net,negative
"Anxiety &amp; depression after COVID-19 infection results from the COVID Symptom Study | Journal of Neurology, Neurosurgery &amp; Ps…",negative
The spread of COVID-19 has been devastating for the millions of people who have been infected by the virus and lost their lives and the tens of millions of people who have lost their work and livelihoods.,negative
"Thursday, 9/30, at Bridgestone Arena.",positive
"Friday, 9/17, at Capital One Arena.",positive
Super simple poll.,positive
"Thursday, 9/16, at Wells Fargo Center.",positive
Super simple poll.,positive
Ga…,neutral
Mark Zuckerberg Emerges From Under Man's Bed To Ask Him If He Would Like Some Information On COVID-19,positive
BREAKING CA will require our kids to get the COVID-19 vaccine to come to school.,negative
Masks are required while shopping.,neutral
"\"The Impact of COVID-19 on Micro and Informal Businesses in South Africa\"",positive
"",""
LOVE ON TOUR. SHOP MERCH EARLY.,positive
All ticket holders must…,negative
"The biggest lesson from the Covid-19 fight is that, India has unparalleled ability to unite and a tremendous capacity to deli…",positive
"'Secondary schools in Merthyr Tydfil, Bridgend, and Rhondda Cynon Taf reintroduce face coverings as a precautionary measure.…",negative
COVID-19 vaccinations available on-site. Schedule your appointment now with   (Please bring y…,negative
New  Using multiple COVID19 prevention strategies WORKS in limiting the spread of COVID-19 in congregate setting…,negative
Newsom has just mandated COVID-19 vaccinations for all children in K-12 schools.,negative
Masks are required while shopping.,neutral
ARYNews,neutral
65% say…,positive
Three GTA schools report COVID-19 outbreaks,negative
Dr Ryan Cole explains that the Covid-19 jabs are suppressing TLR4 which is what helps prevent cancer - so the jabs promote cancer. Drs are reporting quick development of cancers after the jabs.,negative
(California becomes first state to announce a COVID-19 vaccine mandate for s…,negative
"Who are you, Dr. Goose?Merck makes Ivermectin &amp; reports",positive
Masks are required while shopping.,neutral
"",""
Yes what happened to all the empty vaccine allegations in the past,negative
"Excellent thread on what endemicity really means. If we decide to let COVID-19 become endemic everywhere, it doesn’t mean it…",positive
"\"Do you believe Americans should lose their jobs if they object to taking the COVID-19 vaccine?\"",negative
65% say…,positive
"The biggest lesson from the Covid-19 fight is that, India has unparalleled ability to unite and a tremendous capacity to deli…",positive
COVID-19 Detention Camps Are Government Round-Ups Of Resistors In Our Future?,negative
bitcoin bsc covidtoken crypto cryptocurrency covid19 token,positive
"tfw your COVID-19 vaccine card \"badge holder\" is way better than your actual badge holder",positive
