Covid19 CoviShield AstraZeneca,positive
"“Nate Toledo of Roseville first fell ill with coronavirus on September 9, along with his two and four-year-old sons and wife Taylor Toledo. They were not vaccinated for coronavirus.” GetVaccinatedNow MaskUp",negative
Global COVID-19 deaths hit 5 million as Delta variant sweeps the world,negative
Can someone help me with this hard medicine problem? Can the benefit of an experimental medication outweigh the risk when…,negative
"People who are vaccinated against Covid-19 are less likely to spread the virus even if they become infected, a new study finds…",negative
COVID-19 DEATHS MOVE TO 78,negative
"US COVID-19 death toll hits 700,000 - Reuters  via",negative
VA Boston-Led Retrospective National Cohort Study Results Raise Questions About COVID-19 Hospitalization Metrics,negative
29 m  ·,positive
"* Local community cases 2,079",positive
Super simple poll.,positive
The news is pretty grim 🧵,negative
UPDATE NSW received $6.15 billion in Covid-19 disaster payments compared to $2.4 billion for Victo…,negative
FDA panel votes against Pfizer’s Covid-19 booster jab application,negative
* Dormitory cases 818,positive
65% say…,positive
"From today (Oct 1, 2021) the mandatory quarantine rule for people travelling from SouthAfrica to the Netherlands has…",positive
COVID-19 in Jharkhand,negative
"",""
"16,220 Floridians reportedly died from COVID-19 since end of July which is 250 deaths a day.",negative
I have just seen a US version...let's see what Aussies think!,positive
"They are a 79 y/o female, who passed away in the primary isolation section at Harrison Point…",negative
"We set up 25 monoclonal antibody sites across Florida, and we’ve seen about a 70% reduction in COVID-19 hospitalization…",negative
I thought we lived in America not China oh wait it’s Lying Biden and the Ho supported by the Democratic Party who hates Americans No Jab? No Service. Doctors Flip The Script On Covid-19 Vaccine Mandates NewsBreak,negative
Should rare cases of heart inflammation put your COVID-19 vaccine plans on hold? | American Heart Association,negative
Global COVID-19 deaths hit 5 million as Delta variant sweeps the world,negative
"We set up 25 monoclonal antibody sites across Florida, and we’ve seen about a 70% reduction in COVID-19 hospitalization…",negative
"Life is hard, and it gets harder if you cosplay as militantly stupid.",positive
Around 200 refugee detainees at Melbourne detention centre are being tested for COVID-19 as a precautionary measure after a staff member at the facility tested positive for the virus.,negative
"",""
I keep learning new things about Science,positive
Advisory committee endorses third dose only for elderly and at-risk groups in blow to Biden,negative
*…,positive
"16,220 Floridians reportedly died from COVID-19 since end of July which is 250 deaths a day.",negative
A Report on Myocarditis Adverse Events in the U.S. Vaccine Adverse Events Reporting System (VAERS) in Association with COVI…,negative
"Board-certified pathologist, Ryan Cole, MD, explains how Pfizer’s Covid-19 mRNA vaccine reprograms innate immune response…",positive
How many monoclonal antibody sites does Ontario have?,negative
COVID-19 Testing Update. For more details visit     …,positive
"Another 714 COVID-19 cases in B.C. Friday, 11 more deaths – Saanich News",negative
"So, not COVID-19 related, however, this is really exciting news I wanted to share. Phase I trials of Moderna's HIV vacc…",positive
"She's didn't just pick an empty syringe that \"happens to be there\" yeah. She also didn't push the dose in after she injected th…",negative
“Covid19 is in recess….but its new avatar may not be far….” My quote in this fine article by Teena,positive
"We set up 25 monoclonal antibody sites across Florida, and we’ve seen about a 70% reduction in COVID-19 hospitalization…",negative
"The thing I want to know regarding Brett Kavanaugh’s COVID-19 diagnosis is Who paid off his $92,000 country club fees pl…",negative
Students at one Ontario university could be suspended from online courses if they don't get the COVID-19 vaccine.,negative
New positive cases 12,negative
"",""
I’ve got a bad case of NewsomEnvy.,negative
"Like, politicians announce vaccine mandates for kids",negative
"",""
May be I am Drunk! Too much of that Covid-19 trail medicine,positive
Get This -Inspired Air Purifier To Protect Your Home Against COVID-19,positive
Total active cases- 87,positive
Do you believe that Australians should lose their job if they…,negative
"16,220 Floridians reportedly died from COVID-19 since end of July which is 250 deaths a day.",negative
"CTV \"Pfizer says it has submitted initial trial data for the use of its COVID-19 vaccine in children aged five to 11…",negative
"From October 4, all UK nationals arriving in India from the UK, irrespective of their vaccination status, will have to u…",negative
Global Covid-19 deaths hit 5 million as Delta variant sweeps the world report,negative
before the FDA approves the…,negative
$5.7 BILLION,positive
"",""
Africa is a victim of almost everything that starts in the first world. We are having the worst of Covid-19 in Uganda. We ar…,negative
[JUST IN] Covid-19 update in S'pore on Oct. 1,negative
"",""
How to fail as a state 101,negative
This nurse got fired after hooking up with a COVID-19 patient… 👀,negative
Death so far- 5135,positive
DemCastCA,neutral
🤔 BREAKING - Pfizer stand accused of experimenting on orphan babies to test their Covid-19 vaccine,negative
A physician who serves as a pandemic chief of staff at the Saskatchewan Health Authority says a negative COVID-19 test is…,negative
"Highest number of deaths a day since January, calling in the military &amp; other provinces - so why no shut down?",negative
That's the price tag for treating unvaccinated Covid-19 patients in the past 3 MONTHS,negative
Want to improve the air quality in your home and protect your family from viruse,positive
Please read. Numbers are starting to come out that challenge MSM. Dr Loannidis is a world renowned expert not to be taken…,positive
Bucs Antonio Brown was activated from the Covid-19 List today. GoBucs NFLUpdate,negative
The only test i was able to pass without cheating was COVID-19 test,negative
"CNN On Friday, the United States passed 700,000 deaths from Covid-19, 108 days after it reached 600,000 Covid-19 deaths.",negative
"By  , FreeCovidVaccination camps organized in different places to protect people against COVID-19",negative
"\"Do you believe Americans should lose their jobs if they object to taking the COVID-19 vaccine?\"",negative
Total recovery 343016,positive
Follow our updates on coronavirus here,positive
"Moderna, Inc. (MRNA), Novavax, Inc. (NASDAQNVAX) - Why Moderna, Novavax And Other COVID-19 Vaccine Stocks Are Plummeting",negative
"COVID-19 Update Proof of vaccination required for public servants | 1,706 new cases, 20 deaths | Alberta accepts help from Nfld.",negative
Heart inflammation rates higher after Moderna COVID-19 vaccine - Canada data,negative
"ok wat betekent dit \"Inclusion of ivermectin in treatment regimen of mild to moderate COVID-19 patients could not be said with certainty based on our study results as it had shown only marginal benefit in successful discharge from the hospital with no other observed benefits.\"?",negative
"We set up 25 monoclonal antibody sites across Florida, and we’ve seen about a 70% reduction in COVID-19 hospitalization…",negative
Thank the GOPDeathCult  and the guy with the orange face for those deaths....,negative
Super simple poll.,positive
"NEW CASES 2,909",positive
↓,neutral
Recovery ra…,negative
"Malawi COVID-19 Update, October 1, 2021 17 new cases, nil death,,,",negative
"16,220 Floridians reportedly died from COVID-19 since end of July which is 250 deaths a day.",negative
"We set up 25 monoclonal antibody sites across Florida, and we’ve seen about a 70% reduction in COVID-19 hospitalization…",negative
Clovis parents are crying and throwing up rn.,negative
"⛔️⛔️ I would highly reccomend that everyone reading this look up, “Cyber Polygon World Economic Forum”…",positive
"This is all such a scam. We could repurpose ivermectin for so cheap. None of this is about public health, it’s about c…",negative
COVID-19 status in Malaysia as of 1 October 2021.,positive
"",positive
"Hi  . Of the 41 tweets sent by  the last 5 days including today, not one mentioned anyth…",negative
Our big new study on the infection fatality rate of COVID-19 in developing countries is out,negative
65% say…,positive
Stanford Epidemiologist John Ioannidis is back again with his assessment of  “age-related survival rates” for Covid-19…,positive
Please read. Numbers are starting to come out that challenge MSM. Dr Loannidis is a world renowned expert not to be taken…,positive
Georgia cop who pushed people to take horse dewormer instead of vaccine dies from COVID-19,negative
💊  An antiviral pill cut the chances of Covid-19 patients being hospitalised by 50% in late-stage trials,negative
"We set up 25 monoclonal antibody sites across Florida, and we’ve seen about a 70% reduction in COVID-19 hospitalization…",negative
Julian Hill MP,positive
👈🏼💦,neutral
Georgia cop who pushed people to take horse dewormer instead of vaccine dies from COVID-19,negative
It took years to get my rescue cat to actually speak up and say something if her food dish was empty when it shouldn't…,negative
"We set up 25 monoclonal antibody sites across Florida, and we’ve seen about a 70% reduction in COVID-19 hospitalization…",negative
Global COVID-19 deaths hit 5 million as Delta variant sweeps the world,negative
"Merck pill seen as 'huge advance,' raises hope of preventing COVID-19 deaths",negative
This feels like Deja_Vu where do I remember hearing something like this? Oh yeah it sounds like what Florida and Texas said not that long after lifting mask mandates,negative
"Malawi COVID-19 Update, October 1, 2021 17 new cases, nil death,,,",negative
"\"Do you believe Americans should lose their jobs if they object to taking the COVID-19 vaccine?\"",negative
"For more details, visit",positive
"Malaysia continues to broaden our COVID-19 immunisation coverage by accelerating vaccinations of 12-17 year olds, 50% of whom…",negative
Burdensome…. Protecting lives is burdensome.  Wow!!  LeadershipMatters,positive
“[T]he Covid-19 pandemic has posed enormous challenges…The biggest question before the entire world is how to restart? The…,positive
Infographic COVID-19 Outbreak &amp; Cover-up,positive
